,CANDIDATE_REF_NUM,UNIVERSITY,EDUCATION,LANGUAGES,SKILLS
54,484649,Balqaa Applied University,Civil engineering,English,"Good problem-solving skills,The ability to pay close attention to detail,The ability to work well as a part of team,Familiarity with computers and software programs"
55,603852,The Hashemite University,Accounting and Commercial Law,"English, Arabic","Excellent communication and social skills.,Able to work as a team member to deal with different minds and categories in multinational environment."
56,421277,Tafila Technical University-TTU,Accounting,"Arabic,English","Leadership,Communication skills,Strategic planning,Good speaker,Business process improvement,Works under pressure,Skilled in Microsoft Office Programs (Word, PowerPoint, Excel)"
57,460988,Yarmouk University,Accounting and Management,"ARABIC Native Language,ENGLISH Very Good","Quick Learner,Teamwork Skills,Good Organization,Problem Solving,Microsoft Office,Able to understand standard accounting entries.,Able to work under pressure.,Able to adapt in the work enviroment.,Attention to detail.,Good behavior in difficult situations.,Self motivation for learning and time management."
58,476214,(Al-Balqa Applied University),B.Sc. degree in Accounting (ACC),"Arabic: 100%,English: 85%","self-learner,Good knowledge in Internet Websites.,Team player & able to work under pressures.,Good commands of English & Arabic.,Good communication,Creativity and Innovate"
59,575203,AL-Hashemia University,Banking & Finance Science,"Arabic: Mother tongue,English: V. Good (Speak, read and writing)","Team working,Communication and interpersonal,Work under pressure,+Computer skill (desktop application, office & internet ...)."
60,425339,"Amman Arab University,Al-Zaytoonah University","Finance,Finance","Arabic,English","ACCOUNTANCY,ACCOUNTS RECEIVABLE,CONTENT MANAGEMENT,CREDIT,MARKETING,PURCHASING,SHIPPING,WRITING,purchase accounting,petty cash,reconciliation,accounting,payments,tally,microsoft powerpoint,payroll,teamwork,mba finance,planning,sales tax,team management,order,analysis,auditing"
61,405792,University of Jordan,Risk Management & Insurance,"ARABIC,ENGLISH","Communication Skills,Time Management,Work Under Pressure,Flexibility,Creativity,Computer Skills"
62,468115,"The University of Jordan -,AlManar Secondary School",B.A in Management Information Systems,"English - Excellent in Reading, Writing, and Speaking.,Arabic - Native Language","Proficient in Microsoft office applications,Teamwork,Confident and responsible,Service focused,Self Motivated,The ability to work under pressure,Time Management,Planning and strategic thinking,Data performance and Analysis"
63,444025,"Academia de Studii Economic,,Princess Sumaya University for Technology,,De La Salle Frere,","international business management,Accounting","Arabic:,English:,French:,Romanian:","Excellent communication, adaptability, and collaboration skills.,Advanced problem solving, numeracy skills and working under pressure.,Proficiency in negotiation skills and building positive relationships.,Proficiency in dealing with CRM programs."
64,602481,"University of Jordan,Amman",Accounting,"Arabic: Mother tongue,English: Good read, written and spoken",I have the ability to work under pressure and convince the clients through a few words and a good follow up as well; furthermore I can put the plan that it could help us in the market with any situation.
65,528013,The Hashemite University,Accounting,"Arabic,English","Time management,Communication.,Perseverance and motivation,bank reconciliation,Problem solving"
66,422330,Al-Balqa Applied,Banking and Financial Sciences,"Arabic (Mother Language),Good command of English (reading, writing, and speaking)","Being active, social, reliable, hard working and trustworthy, I welcome challenges and enjoy working alone as well as teamwork,Microsoft Office Excellent & Internet and E-mail Knowledge.,Computer Driving Skills .,Microsoft Office Package (MS Word, MS Excel, MS PowerPoint ...).,Printing in English and Arabic,Soft skills certification from Darb 1 summer training program,Contact with people and dealers.,Listen to people with focus skill.,Time Management .,Work under pressure.,Convince the customer of loyalty products,Handing a high volume of in-bound calls and greet customers in a courteous and professional manner.,Assess and evaluate customer concerns and resolve their problems in an efficient and timely manner.,Provide product and service information to our customers.,Promote products and services by understanding customer needs and interest and providing them with the right offers that match those needs.,Troubleshoot service equipment issues,Adhere to, and fulfill, individual and team Performance Metrics."
67,438346,"Al Albayt University,",Accounting,"English,Arabic","I can work on all Microsoft Office programs, windows and the Internet,Capable of communicating complex information to individuals and groups,Able to give and receive instructions and maintain active listening in times of stress,Excellent Communication Skills,Process improvements"
68,569051,Hashemite University,Management Information System,Unknown,"Able to work under pressure and meet deadlines.,Able to work alone as well as within a team.,Good communication skills.,Computer skills: Microsoft office (Excel, Word and PPT)."
69,423491,University of Jerash,Accounting,"Arabic, English","Accounting,Using a computer,Microsoft Office,Writing reports"
70,444853,Al- Balqaa Applied University / Amman College,Accounting,"Arabic (Native).,English (Good).","Establishing employees database.,Processing payments and refunds.,Preparing Salaries and Benefits reports.,Preparing, verifying, and processing invoices.,Receving and supplying spare parts and goods to the technician,Preparing yearly Stock taking.,Purchasing local inquiries .,Very Good experience in Quick Books Accounting program .,Teamwork.,Communication.,High performance.,Decision maker.,Organizing.,Ability to initiate and manage new financial systems.,Great experience in Microsoft office programs which gives me great experience in Data Entry field."
71,485583,balqa applied universty,bussines administration,"Good at English language writing, reading and pronunciation","sales,problem solving,team building,Collaborate and work as a team,work under pressure,Good computer skills on Word, Excel and e-mail applications,spss"
72,484961,جامعه ال البيت,إدارة أعمال,Unknown,Unknown
73,530602,Hashemite University,Accounting,"Arabic: mother tongue.,English: very good writing, speaking and reading.","Good command of using internet and computer programs as word excel, power point...etc.,Capable to work with team.,Work under stress of work.,Good communication skills.,Taking part in social activities."
74,445949,Al al-Bayt University/Jordan,B.Sc. in Finance and Banking,"Arabic: Mother tongue,English: good","Skills in mathematics and technology ?The ability to calculate and deal with numbers ? Communication skills with different groups of people ? Mental skills and analytical skills ? Follow up the latest global developments, specifically financial matters ? Promptitude ? Attention to the last detail Accuracy of observation sense of responsibility ? Problem-solving skills and dealing with difficult situations ?Work under pressure ? Teamwork ? Good knowledge of computer skills, specifically familiarity with Excel program ?Ability to learn quickly"
75,530669,Al-balqa Applied University,Accounting,Arabic fluent /English middle,"Self-learning and self-starter.,Great time management with respect to meet deadlines,High and stable performance under pressure.,Problem solving and finding root causes problems,Switching challenges and obstacles to opportunities.,Ability to work individually or in teams.,Communication and relationship building skills.,Computer Skills: Microsoft office (Excel, Word, PowerPoint)."
76,407534,Zarqa University,Business Administration,Unknown,"Preparing financial statements,Financial assistance,Financial reviews,Financial research,Financial reports,Financial record keeping,Understanding of financial reporting,Financial document review,Financial report analysis"
77,531047,AIBIqaa Applied University - Amman,Accounting,"Excellent in Arabic (Reading, Writing, speaking),Very good in English (Reading Writing speaking)","ERP System Oracle,JDE Edwards,Outlook,Microsoft Office"
78,410481,Unknown,Accounting,"English,Arabic","MS-Office,Accounting,Software,IFRS,Advanced,Excel,HR,Software,Prepare tax returns, payments, necessary paperwork, and reports.,Assess and research difficult tax issues to identify solutions.,Manage and maintain the companys tax database.,Determine tax savings and recommend strategies to improve profits.,Head of internal auditing dept. for some companies who reviews and controls financial and administrative practices and procedures follow up and match inventory Creating excel files for depreciation of corporate assets. high experience in accounting software such as (ERP, Oracle, Stallion and GFMIS)"
79,500128,University Of Jordan.,Business Economic,Unknown,"Organization and attention to detail.,Communication skills.,Time management."
80,412253,"Al-Balqa Applied University,Al-Balqa Applied University,Ahmad Toukan - Secondary School","Accounting,B.A. in Accounting Information Systems","Arabic: excellent; speaking, reading, and writing.,English: very good; speaking, reading, and writing.","Communication skills,Accounting skills,Analytical thinking,Effective interpersonal,Problem solving,Technical skills,Critical thinking,Smart work,Team work"
81,407157,Zarqa Private University,Accounting,"Arabic,English","BSTC (Nissan) Jordan,Senior Account Receivable Accountant.,Monitoring AR accounts through periodic reconciliations and follow-up.,Responsible for the bill safe, receiving new transactions, registering them,,Reschedule Promissory notes or AR accounts, calculate interest or,Create new or update approved customers,Record received transfers from customers via wire transfers or in any other,Record car insurance bills, and prepare periodic reconciliation.,Review and analyze client accounts to ensure outstanding balances,Prepare monthly closing AR Reports such as aging report, analysis AR,Acknowledge in Microsoft,Office (Word, Excel),Experience in the,Accounting softwares,Microsoft Dynamics GP,NetSuite oracle.,DAR3 oracle ERP system.,Provide support for collection department regarding due invoices,,Prepare certain financial reports and explain variances to support,Release car mortgage applications on cars via gathering all needed information.,Follow up on service contracts and provisions and tracking all of type of,Provide appropriate accounting information to customers when needed.,Conduct needed analysis to offer recommendations on risk mitigation,Assist in managing late, watch list, doubtful, bad customers, and legal cases.,Responsible for the oversight of daily invoicing and billing processes,Participate in year-end stock count committee.,Dar Al Zahrawi Medical Co.,General Accountant,Preparing financial analyses and reports.,Preparing revenue projections and forecasting expenditure.,Assisting with preparing and monitoring budgets.,Maintaining and reconciling balance sheet and general ledger accounts.,Investigating and resolving audit findings, account discrepancies, and issues of,Generate weekly, monthly aging reports,Maintain accounts receivable customer files and records.,Prepare Provision for bad & Doubtful Debt.,Follow established procedures for processing receipts, cash etc.,Maintain up-to-date billing system.,Carry out billing, collection and reporting activities"
82,423095,"Yarmouk University,,Model School",Accounting,"Arabic:,English:","Ambitious, hard working with eagerness to learn.,Excellent ability to work under pressure and various circumstances.,Very good communication skills.,Reading skills.,IT Skills."
83,569189,HASHEMITE UN.,BECLOE IN ACCOUNTING AND COMMERCIAL LAW,Unknown,ADMINISTRATIVE SKILLS
84,505126,Applied Science Private University -,Finance and Banking Management,Unknown,"Inbound call management,Problem resolution,Team player,Microsoft Office,problem solver,Time Management"
85,568410,"AL-ALBAYT UNIVERSITY,MARJ ALHAMAM HIGH SCHOOL",Bachelor of Accounting and business low,Unknown,"JD Edward (Oracle ERP System),SAP ERP System,Quickbooks,Very good knowledge of MS Office (Excel, Word, Outlook, PowerPoint) and Familiar with relevant computer software,Attention to detail,Ability to meet tight deadlines,Good with numbers and figures with an analytical mind,Ability to work on own initiative,Flexibility and Team player,Negotiation skills and the ability to develop strong working relationships"
86,603943,Balqaa applied university,Accounting,"English,Arabic","Teamwork,Work Under Pressure,Ms Office,Excel,Scenario Analysis"
87,422769,Yarmouk University -,Accounting,"Arabic,English","Customer Relations Excellent,Financial statement review Excellent,Fraud knowledge Very Good,Account Reconciliation Very Good,MS Office Suite Very Good,Cash Flow analysis Excellent,Superior attention to detail Very Good,Risk management,Problem solving,Time management,Communication skills,Software"
88,567921,"Yarmouk University Jordan,",Accounting,English and Arabic,Unknown
89,409240,University of Jordan,B.S. in finance,"Arabic,English","Hard working,Team leader,Ability to work under pressure,Communication skills,Computer skills advanced Knowledge in MS Word,excel and power point,Ability to research data online and extracting information,Public speaking,Desicion making"
90,473566,University of Jordan,Finance,"Arabic,English","Good command of MS office,Fast Learner,Ability to build strong relationships with clients,Ability to work under pressure"
91,408412,Al-Isra University,Bachelors In Accounting,"Arabic: Mother language,English: Very Good","Phone etiquette, team work ability to work under pressure and to learn fast and acquire new skills"
92,493204,Al Balqa a University,Accounting,"Arabic - Excellent,English- Very good","Fluent in English and Arabic (Reading, Writing, and Conversation).,Strong analytical, facilitation, organizational and problem-solving skills.,Team player with a track record of collaborating across disciplines.,Excellent verbal and written communication skills, as well as an overall ability to be clear and concise in all communications.,Ability to work both independently and in a dynamic, cross-functional global team structure.,Highly proficient in Microsoft Office suite.,Flexibility and Adaptability.,Ability to manage and work through change in a proactive and positive manner.,Prepared to travel for work."
93,415751,Yarmouk University,Banking and Financial sciences,"Arabic (fluent speak and write),English (very good speak and write)","Very good command in communication skills,Initiative, self-motivated, able to work under pressure,Well Organized with team spirit"
94,721667,Notre Dame University - Lebanon,Business Management,"English,Arabic,French","Auditing,Accounting,Invoicing,Feasibility Studies Budget Assessment,Analytical and problem solving,Organisation & time management,Verbal and written communication,Ability to work autonomously Critical thinking and deductive or collaboratively reasoning,Deductive reasoning Time Management"
95,409746,Al-Balqa Applied University-Jordan,Accounting Information Systems,"Arabic: Native language,English: Good","Good Computer and MS Office Skills,Excellent Communication Skills,Team player, attention to details,Flexibility and Willingness to learn,QuickBooks Accounting system,Training on SAP/ERP System"
96,404416,Yarmouk University,B.Sc. in Accounting,Arabic: Mother tongue. English: Excellent.,Innovation Decision Making Problem Solving Attention to Details Time Management
97,479576,The University of Petra,accounting,"Arabic: Excellent spoken and written.,English: Excellent spoken and written.","? Providing the customer with required data, and replying their queries.,? Ensuring the customers satisfaction, and inform them with latest attractive offers.,? Dealing with customers directly, and trying to convince them with latest company offers.,Selling varieties of company products and achieving the monthly target.,Filling the data and completing the subscription.,Worked as call center advisor for six months, received calls and answer the customer inquiries, etc.,Worked as retention advisor (handle the cancelation issues by keeping the customers at orange).,Worked with the risk team to inform the customers about the unbilled amounts and their usage.,Microsoft Office: Excellent,Internet Browsing: Excellent,Companys dedicated software: Excellent"
98,407151,"Mutah University (MU), Karak Jordan",Finance and Business Economics,"AR,EN*","Manipulating, cleansing & processing data using Excel,Performing daily system checks,Data entry, data auditing, creating data reports & monitoring all data for accuracy.,Generates, monitors, gathers, and interprets reports and submit to management.,Reported bi-monthly data analysis findings to upper management to use in making organizational decisions,Participated in collecting, organizing, and interpreting data along with colleagues,Preparing accounts and tax returns,Monitoring spending and budgets,Compiling and presenting financial and budget reports,Keeping account books and systems up to date.,administering payrolls and controlling income and expenditure,Tracking payments to internal and external stakeholders,Manage balance sheets and profit/loss statements,Financial Controls and Financial Reporting,Financial operations and consolidation of subsidiaries,Manages treasury function,Handling petty cash and cash-related transactions such as issuing receipts and vouchers,Recording transaction entries and generating reports while ensuring compliance with the companys financial and accounting policies and procedures,Calculating purchases expenses to issue goods cost report,Performing other duties related to the job assigned by the direct supervisor,Time Management Skills,Organizational Skills,High Communication Skills,Negotiation Skills,Team Player,Problem Solving Skills,Reporting Skills,ERP System (Microsoft Dynamics),Microsoft (Word, Excel ""Advanced"", PowerPoint)"
99,603436,"UNIVERSITY OF JORDAN, AMMAN",Accounting,"Arabic,English","Organization & Time management,Oracle JD Edwards,Analytical thinking,Problem Solving,Oracle ARCS,Microsoft Office"
100,422425,"Al-Balqa Applied University,,Al-Imam Ali Ben Taleb High School,",B.Sc Accounting Information Systems,"Arabic (Native Language),English (Good; Spoken and Written)","Determined Self-Initiative,Interpersonal Skills Time Management,Motivational Working Under Pressure,Accounting and Sales Communications and Organizational Skills,Office Management Team working and Working to Strict Deadlines,Network Fundamentals Personnel,Problem Solving Writing Reports,HR and Administration Customer Service,Microsoft Office,Internet Applications,Accounting Program Systems (ERP)"
101,567516,"O.M.Beketov National University of Urban Economy in Kharkiv,O.M.Beketov National University of Urban Economy in Kharkiv",Management,"Arabic: Native,English: Very Good,Russian Fluent :","Sales,Active Listening,Time Management,Computer,Software, Word, Excel & Internet,Accountant,Team Work,Communication Skills"
102,567932,The University of Jordan,Finance,"English - Very Good,Arabic Fluent","Financial Analyst.,Preparing Financial statements skills,Cost variances analysis skills.,Bank reconciliation & Bookkeeping skills.,Budget Analysis.,Operational Efficiency Analysis,Technical issues analysis.,Customer service expert & Time management skills.,Microsoft Office skills"
103,407663,"Yarmouk,University",Economics,"Arabic: Mother tongue.,English: Very Good","Achieved a profit rate higher than required by 30%,i Reach full customer satisfaction and Speed in data entry and full accuracy.,Knowledge the policies of the central bank,Knowledge the internal policies of banks,Knowledge of the banking system,Knowledge how to grant loans of all kinds,Knowledge the different types of bank financing,Knowledge the types of income proof,The ability to calculate the debt burden according to the policies of the Central Bank and the internal policy,Knowledge of credit information systems,Knowing bank estimations,The ability to study the clients situation,The ability to attract clients,Ability to negotiate and persuade clients,Knowledge of loan guarantees from guarantees and mortgages,Knowing the types of financing,The ability to draw up a marketing plan,Ability to develop and create projects,The ability to do free marketing is equivalent to the financier,The ability to apply the system against the problem,The ability to attract clients,The ability to memorize and speak,Experience with Microsoft office Excel & Word.,Excellent communication skills with a focus in customer service.,Active listening and Flexibility,Leadership, Responsibility, and Attention to Detail,Positive behavior and charismatic personality,Time management and multitasking skills,Initiative and creativity,Ability to work for long hours under pressure.,Creative and innovative,Ability to Work Independently and in Team,The ability to adapt to different working conditions and the ability to change for the better,The ability to continuously learn and intrinsic motivation,Effective interpersonal skill.,Ambitious and collective participation.,Self-learning and self-motivation.,Enthusiastic and flexible teamwork,In-depth knowledge of theoretical formulation and mathematical inferring ofcomplete problems.,Notable momentum in utilizing statistical tools and e exciting related arithmeticAnd greater scientific aptitude with absolute solution striving work attude.,Tremendous variety "
104,403957,Al-Zaytoonah Private University Of Jordan,Business Administration,"Arabic Native,English: Very good (reading, writing and speaking).","Excellent computer skills (Microsoft windows, Microsoft office),Ability to work under pressure and handle multiple tasks,Ability to work well within a team,Critical thinking skills,Flexible,Organization skills,Excellent communication skills,Account reconciliations,General ledger maintenance,Bank reconciliations and balancing,Report writing,Prepare tax reports and handle sales tax issues."
105,427874,AL-BALQA APPLIED UNIVERSITY,ACCOUNTING INFORMATION SYSTEM,"English,Arabic","excellent communication skills with people on all levels,Ability to learn new skills quickly, and work under pressure,Self Motivated,Multi-tasking,Team Worker,very good at Microsoft office (excel,word)"
106,583770,Petra university,B.A in Marketing,"English (very good in speaking, writing and reading).","Accuracy in meeting deadlines.,Excellent public relations.,Able to work on own initiative and under stress.,Cooperative and good in team work.,The ability to solve problems.,Strength of character and spirit of initiative.,Good knowledge on using Microsoft Package (Windows - Office).,Search Engines and Browsing on the Internet.,Solving medium technical issue."
107,427386,"Hashemite University,",Financial and Banking Science,Unknown,Financial Services customers service Banking Customer Relationships Negotiation Persuasion
108,537966,Yarmouk University,Administrative Science,"Arabic,English","Accounting,Managment skills,Computer Skills,presentation skills,Interpersonal skills,communication skills"
109,530356,"Amman Arab University,Mutah University","Banking & Financial sciences,Finance","Arabic,English,Russian","conflict resolution,Communicating with external vendors,Reviews insurance forms for accuracy and completeness.,Resolve claim issues promptly and follow-up on outstanding issues,Perform negotiation with insured and claimant to achieve claim settlements,Communicate claim status to supervisor and customers on regular basis,Effective Communication Skills.,Time Management.,Team Leader,Coaching,Customer Service,Problem Solving,Expert in Delegating Tasks"
110,500172,MUTAH UNIVERSITY,Accounting,"Arabic,English","Problem-solving skills,Communication skills,Have driving licence,Strong decision maker,Time managment,Team work,Microsoft Office Suite"
111,442782,AL-Ahliyya Amman University,Accounting,"Arabic: Mother Tongue,English: Reading: Excellent Writing: Very Good Speaking: Very Good","Analytical Ability,A Methodical Approach and Problem-Solving Skills,Ability to build credibility and establish good relationships with partners,Excellent communications skills to persuade influence and negotiate,Teamworking Ability,Self-Motivation,High Level Of Numeracy,Communicative,Creativity,Punctuality,Organized"
112,567758,The Hashemite University,Accounting,"Arabic: Mother Tongue,English: Very Good","Treasury Management,CertIFR,Strong troubleshooting,Creative problem-solving skills,Ability to multi-task,High attention to detail,Initiative to drive improvement and efficiencies process,Ability to work independently,Drive to meet and exceed deadlines"
113,517721,Al Balqa Applied university,Accounting information systems bachelor,Arabic (fluent),"Accountant,Microsoft word,Microsoft Excel,Microsoft outlook,Microsoft power point,Microsoft gp dynamics,able to work under pressure"
114,402697,Yarmouk university,accounting,Unknown,"Looking for a challenging position that improve and develop my skills In accounting field and build my career as an accountant.,Looking for a job that develop my skills as sales representative,Looking for a job that enhance my financial income,Ability to deal with excel, word, power point, quick books.,Ability to deal with numbers, ratios, and data analysis.,Ability to work under pressure .,Ability to deal with customers.,Valid Driving license."
