,CANDIDATE_REF_NUM,UNIVERSITY,EDUCATION,LANGUAGES,SKILLS
115,579946,"Al-Balqa Applied University,,Al-Balqa applied university",accounting,"Arabic: Mother language,English Very good)","Excellent Communication Skills.,Excellent Computer Skills, Software & Hardware,Ability to work under pressure and within a team.,High skills in MS Office.,- Enthusiasm in Learning.,-Time Management Skills"
116,513593,Mutah university,Bachelor of accounting,??,"Hard Working,Quick Learner,Team work,Organization Skills,Smart,Accountants qualification,Microsoft Excel"
117,511762,Al-Zaytoonah University,Accounting,Unknown,"Know the use of computers and the Internet.,Detail-oriented, efficient and organized professional with extensive experience in accounting systems.,Fast learner and self-motivated.,Complex problem-solving skills and a methodical mind.,Excellent communication, assessment and evaluation skill.,Know the use of Microsoft office applications and an excellent manner."
118,443660,The university of Jordan,Accounting,"Arabic (Native language).,English (Intermediate).,Russian (Upper Intermediate).","Efficiency in using Ms office (word, PowerPoint, excel). & internet tools. Ability to motivate others and build a team environment. Effective communication and strong organization skills. Strong leadership skills. Efficient and accurate."
119,565137,"Yarmouk University Jordan, Irbid,Code Fellows in Luminus Technical university collage Jordan, Irbid",Bachelors of IT (MIS) in Management Information System,"Arabic,English,English speaking","Project Management .... Software Development Web Service ????Enterprise Resource Planning ....Independent Thinker Leadership Skills,HTML, CSS, JavaScript, Java, SQL, DATABASE NORMALIZATION Node.js, Next.js, Entity Framework, Spring MVC, Android Git, GitHub, Agile, VS Code, Visual Studio, Android Studio, Intellij, Heroku, PostgreSQL, Web Sockets, AWS EC2, AWS S3, AWS Cognito, AWS DynamoDB, AWS Amplify, AWS Joe Mamas Diner, AWS SNS, AWS API Gateway, SQL"
120,506783,The University of Jordan,ACCOUNTING,"Arabic,English","Communication,Accounting Skills Microsoft excel Microsoft Word Team Working Work Under Pressure"
121,456400,Mutah University,Communication Engineering,"Arabic: Native Language,English: Very Good Command","Projects Scheduling & Time Management skills,Strong analytical ability & troubleshooting skills,High Communication & Computer skills,Teamwork & Problem Solving,AutoCAD skills"
122,411480,"University Of Jordan,",Actuarial Science,Arabic and English,"Microsoft Dynamics NAV,SPSS (Statistical Package for Social Studies),Microsoft Excel (Advance),Omega (Financial Software / Inventory Management),Minitab program,Microsoft Office and Internet Applications,QuickBooks"
123,425547,Applied Science Private University,Accounting (English Language),"Arabic (Native): writing, speaking and reading.,English: Very good writing, speaking and reading.","Prepare daily income/sales and journal entries.,Preparation of annual income tax and sale tax.,Prepare payroll including salaries & social insurance.,Process refunds, returned checks and bad debts.,Reconcile bank account and settlements.,Reconcile accounts payable and receivable,Reconcile and maintain balance sheet accounts.,Check and follow up on inventory accuracy against reported transactions.,Prepares asset, liability, and capital account entries by compiling and analyzing account information.,Prepares payments by verifying documentation, and requesting disbursements.,. Maintain accounting controls by preparing and recommending policies and procedures,Payroll,Corporate Tax accounting,Bank reconciliation,Budgeting,Cost accountant,Oracle ERP,Risk Management,Critical thinking,Effective communication skills,Project planning,Time management"
124,517798,Al Zaytoonah University Of Jordan,Accountant,"Arabic,ENGLISH","Commuication skills,Time management skills,Work under pressure,Work effectively in both self-managed and team managed projects,Computer skills in Microsoft office (Word, Excel, and PowerPoint).,Quick learner,Keen to learn and improve skills,Self-motivated,Flexible,Presentation skills"
125,542808,Yarmouk University,Finance and Accounting,"Arabic: Writing: Excellent, Reading: Excellent, Speaking: Excellent,English: Writing: Good, Reading: Good, Speaking: Good","Good administrative skills,Self-motivated and quick learner,Good Communication skills,Advanced Business Users Skills using QuickBooks and Odoo OpenERP"
126,424892,Tafila Technical University,Accounting,"Arabic (Native language),English (Excellent)","Maintain financial records.,Analyze financial information & prepare financial reports.,Compile and analyze financial information to prepare entries to accounts.,Analyze financial information detailing assets, liabilities, and capital, and prepares balance sheet profit and loss statements, and other reports to summarize current and projected company financial position .,Internet and Computer Maintenance.,Windows, MS Office (word, Excel, PowerPoint)"
127,797256,"Sanaa University,Amideast,Mali Institute,Baghdad Institute,Al-Hurash School",Bachelor of Commerce & Economics - Accounting Section,"Arabic,English","Intercultural skills: Good ability to adapt to multicultural environments, gained though my language study experience; also I have dealt so many times with foreign callers even I have been selected as assistant in the VIP & foreign group at Sabafon call centre. And; I have worked in contact with many Indian & Lebanese auditors.,Ability to make quick and excellent decisions and organize thoughts in the face of time. Constraints and full workload & Professional work with finance projects,Strong team player with remarkable interpersonal skill,Creative and resourceful thinking,Interpersonal skills and Social active; with Sense of humour and dignity have ability to make social long-last relationship with contacts from different levels regardless of interests, but based on mutual respect and personal effectiveness as well as persuading skills gained from my work at Sabafon company.,Team spirit: Ability to establish and maintain effective working relations with people in a multi-cultural, multi-ethnic environment with sensitivity and respect for diversi,Negotiation skills: gained through my experience as a call centre executive at Sabafon & through the training I had at Al-Roshed Training Centre in customer service (2008) using neural linguistics programming techniques since its work is not service oriented but based on persuading skills.,Positively proven leading characters, confidence and Admin. Skills when serving in the Finance and Customer Care dept.- Sabafon GSM Company,Planning, Reporting and Analysis skills; ability to interpret and document administrative reports, plans, expense claims, bills and do conduct independent research and analysis, identify issues, and recommend appropriate solutions gained from my experience mentioned above. For instance, I have had arranging and particularly involving in many group meetings at Sabafon.,Creativity and the ability to work with limited resources.,Ability to work under stress or critical circumstances with minimum supervis"
128,441904,Yarmouk University -,Accounting & Finance,"English: Fluent,Arabic: Native","Financial Accounting. Budgeting & Forecasting. Data Analysis. Financial Statements. Internal Controls. Fixed Assets. Bank Reconciliation. Financial Reporting. Accruals. Data Analysis, Critical Thinker, Time Management, Self-Motivated, Cost Control, Leadership Skills, Team player, Attention to Details, Ability to Multi-Task"
129,410005,"Mutah University, Al-Karak, Jordan",Accounting,"English: Intermediate,Arabic: mother language","Effective communication skills to deal with customers.,I feel very confident in communicating with people from all walks of life.,Able to work as part of a team or alone.,Good PC skills, advanced knowledge of Microsoft Office, in particular, Excel.,Good of SPSS."
130,493879,Yarmouk University,Finance and Banking,"Arabic: Mother Tongue,English: Excellent","Computer skills: proficient in Microsoft Office.,Employability skills such as communication willingness to learn, problem solving and resilience.,Excellent in interpersonal communication.,Preparing the financial statements,The ability to respect, organize and manage appointments.,The ability to make decisions.,work with the team in one spirit,Demonstrate strong interpersonal skills.,Work effectively to achieve short or long term team objectives.,Good Analytic skills.,Can determine confidential information and work on need-to-know basis.,Quick learner, Good listener and welcomes changes and personal growth.,I accept the constructive criticism.,The ability to adapt to different working conditions and the ability to change for the better,The ability to continuously learn and intrinsic motivation,The ability to self-motivate,Take Responsibility, Positive, Orgnization, and Flexability,Time management,Attention to detail,The ability to work under pressure,Leadership and management skills"
131,489436,Yarmouk University.,Accounting,"Arabic: Native (tongue language),-English :Very Good (speaking, reading and writing)","Team work, Individual work, Work under pressure, Office work, Self-Motivated, Hardworking. Time management, Fast work, Productivity, Communication Skills, Creativity, Leadership, Flexibility, Responsibility."
132,480108,Hashimate university,Accounting,"Arabic,English","Customer service,Team work,Communication skill,Work under pressur"
133,547838,AL AL-BAYT UNIVERSITY,Accounting & Business Law,"ARABIC,ENGLISH","Flexibility,Honesty,Communication,Life Skills,Work Under Pressure,Time Management,Team Building,Problem Solving,Decision Making,Sales"
134,409370,Mutah University of Jordan,Accounting,"Arabic: mother language,English: Excellent in both writing & reading, very well in conversation","analysis,technologies,systems,clearly articulate,interact with both finance and non-finance staff,Strong communication skills.,Decision making, critical thinking, organizing and planning.,Time management and office management.,Self-motivated, initiative, high level of energy.,Adaptability and ability to work under pressure.,Problem analysis and problem solving.,Tolerant and flexible to different situations"
135,521948,Al-Balqa Applied University,"Computer science,COMPUTER SCIENCE DEGREE",Bilingual,"Team Player,Content Writing,Social Media"
136,445633,"Al-Balqa Applied University,Al- Balqa Applied University - Amman University College for Financial and Administrative Sciences. Jordan.",Accounting information systems,"ARABIC: Native,ENGLISH: Very good in English ( reading, writing & speaking)","excellent communicator, reliable, quick learner and able to work on own initiative or as part of a team, adaptable and flexible in all situations. I have a keen eye for detail and good communication skills.,Very good in using file management and multimedia applications.,Microsoft Office: very good in using Excel: Data analysis, data mining and data presentation with competency of applying all categories of functions. Word: All text processing skills including editing, formatting and modifying of reports, letters, memos etc with high typing speed in both Arabic and English. PowerPoint: Competence in preparing different types of presentations. Internet: Very good in using search engines, and communications."
137,603654,The University of Jordan (Amman Jordan).,Actuarial Sciences,Arabic (Mother Tongue) English (Very Good),"Language: Arabic (Mother Tongue) English (Very Good),Computer: ICDL (International Computer Driving License) and Certified as a Microsoft Office Specialist,Time Management -2011,Documentary Credits -2012,Communication skills -2012"
138,567809,"The Hashemite University,The Hashemite University",Accounting,"English,Arabic","Organization & time manageme,Analytical thinking,Oracle JD Edwards,Oracle ARCS,Microsoft Office,visual lease"
139,441324,University of Jordan,Financial Economics,"Arabic,English","Microsoft office, Excel, Word, and Internet,Team working skills and the ability to get along with a wide range of people,Able to work under pressure,Ability to communicate with others smoothly,Ability to cope with the pressure targets and working to tight deadlines,Ability to multitask"
140,561417,"Al-Zaytoonah University,Al-Zaytoonah University","Finance and Banking,Finance and Banking","Arabic,English","mange the team to work more efficiently, handling multiple tasks, team motivation, solve problems that face our team, learn new tasks quickly and professionally and accomplishing the assigned tasks at the required time frame or even before,collect cost information and maintain an expense database, build enterprise data accumulation systems, the ability to determine fixed costs (such as salaries, rent, and insurance), and prepare budget reports. Moreover, I can collect data related to the elements of costs, full knowledge of accounting principles, rules and standards, preparation of budgets and budgets, and the ability to prepare reports and cost systems, management accounting data, financial analysis, and statistical statement of financial statements,Advanced communication & listening skills.,Computer security & internet safety.,Fast typing skills.,Planning & organizational skills.,Problem solving & decision making skills.,Very good with Microsoft office.,Ability to manage time and divide tasks by priority.,Ability to work under minimum supervision.,Very practical and able to adapt to surrounding conditions quickly.,Presentation skills & Critical thinking."
141,445475,APPLIED SCIENCES UNIVERSITY (ASU)-AMMAN-JORDAN,CIVIL ENGINEERING,"ARABIC (Mother Tongue), ENGILISH (Speaking & Writing Fluently)","Construction Engineering (jobsite),Planning,Cost Estimation,Contracting,AUTOCAD / MS Office/ Project Management/ Site Schedule"
142,525037,Middle East University,Accounting,Unknown,"Microsoft Office Suite,Financial reporting,Detail-Oriented,Communication,Good observant,Google Drive"
143,493872,"Hashemite University,",banking and finance,"Arabic (mother tongue),English (fluently speaking, good writing)",Communication Analyzing Accounting Teamwork Computer skill Quick learning Organizing active Listening Intermediate experience with QuickBooks
144,568250,Philadelphia University,Accounting and Finance,"Arabic,English","Data analysis,Knowledge in financial accounting,Cost Accounting,Management accounting,Jordan Tax law,Developing and Empowering others,Change & Innovation,Financial management,Reports,Communicative,Leadership,Creativity,Organized,Microsoft Word,Microsoft Excel,Microsoft Powerpoint,Microsoft Outlook,ERP system,Oracle system"
145,425880,Al-Balqaa Applied University,ACCOUNTING BACHELOR,Excellent Arabic and English,"Accounting and Financial Systems,International Accounting Standards,Financial Systems and Reporting Audit,Computer: MS Office: Microsoft Word, PowerPoint, Excel.,Communication: High communication and presentation skills."
146,436640,Hashemite University,Accounting and Commercial Law,"Arabic Native,English: Good","Excellent Communication Skill,Fast Learner Organizational skills and ability to manage deadlines,Ability to reflect on ones own work as well as the wider consequences of financial decisions,Team working ability,Excellent interpersonal skills,Self-motivation"
147,411105,"The Hashemite University,Idrisi school",Economy,"Arabic: Mother Tongue,English: Good (Spoken, Reading & Written)","Implementation of Microsoft Office Tools including Microsoft Window, Microsoft Word, Microsoft Excel, Microsoft Access and Microsoft Power Point.,Use of internet applications and email.,Ability to deal with Customers and having a good communication skills.,Attention to Detail,Self-Motivated,Creative,Communication skills,Problem Solving,Leadership skills,HR policies and procedures Expert. Employees social security knowledge. Handling all of WRI (work related injuries) and follow up. Strong organization and communication Skills. Selfmotivated with outstanding time management. Innovative and effective hr management techniques. Knowledge with benefits packages and retirement options. . Understanding if labor regulations and legal codes."
148,479711,جامعة البلقاء التطبيقية,"Sociology,Sociology","English Level: (Intermediate) | Experience: More than 10 years,Arabic Level: (Expert) | Experience: More than 10 years","علم الاجتماع,Psychology,. مهارات الإتصال والتواصل Level: (Expert),ICDL Level: (Expert),marketing Level: (Expert),computer system validation Level: (Expert),مهارات الحاسوب والإنترنت Level: (Expert),accounting Level: (Expert),team management Level: (Intermediate),mechanics Level: (Expert)"
149,450546,University Of Petra,Accountancy,"Arabic,English","MS Office,Deadline-oriented,SAP expertise,Team player,Accounting principles,Digital marketing from Google,Standard first aid,Health care provider basic life support,Swimming,Scuba diving"
150,439927,The Hashemite University,Accounting and commercial law,Unknown,"Excellent communication Skills,Learn quickly,Adaptive and creative,Excellent teamwork building,MS Office,Work under pressure"
151,528985,"Jordan University,",business economy,"English,Arabic","? Strong presentation skills using Microsoft applications (PowerPoint, Excel, Word, etc).,? Excellent combination of academic, personal and leadership skills.,? Strong Communication skills,Working perfectly with diverse ethnic groups with different backgrounds levels.,Fast learner and detailed oriented."
152,410038,University of Jordan,Business Finance,"Arabic (mother tongue),English (Good)",Excellent Communication Skills Leading personality Enjoy working/being with people Ability to work on your own without being constantly supervise
153,476120,"HOF UNIVERSITY OF APPLIED SCIENCES,GERMAN JORDANIAN UNIVERSITY",Unknown,"Arabic (Native),English (Fluent),German (Good)","Assisting with planning the workload process for projects,Writing visual basic macros for Microsoft Excel templates,Maintaining staffing Excel sheets in Continental Germany and Internationally,Daily accounting entries and journalizing (Revenues, Expenses),Creating and maintaining Petty Cash, Revenues, and Expenses Excel sheets,Documentation of vouchers."
154,519872,The Hashemite University,Accounting and Commercial law,"Arabic,English","Ambitious and hard worker.,High working load and working under stress.,Encouraging team work in order to achieve common goals.,Good communication skills.,Self-motivated and ability to plan and solve problems.,Process improvement,Problem resolution,MS Office,Cash application"
155,404930,Al Al-Bayt University,Accounting information systems,"Arabic,English","Analytical Approach,Excellent Team Management with communication and interpersonal skills.,Fast Learner,Microsoft Excel,Microsoft PowerPoint,Microsoft Word,Strong ability to work under pressure and time constraints,The ability to work and learn accounting software quickly."
156,413482,Al -alBayt University,Financing & banking,"Arabic: Mother tongue,English good command in speaking & reading & writing","Self-motivation and ability to take the initiative,Quick learner, keen to learn and improve skills.,Ability to work well under pressure,Commercial Banking,Loans & Credit,Mortgage Lending,Client Satisfaction,Presentation Skills,Commercial Lending,Strategic Planning,Portfolio Management,Time Management,Attention to Detail,Relationship Management,Underwriting,Applied Economics,Tactical Decision Making,Resource Management,Process Improvement,Critical Thinking,Business Administration,Key Stakeholder Partnerships,Client Satisfaction,Research & Analysis,Interpersonal Communication"
157,423524,Al Tafielah Technical University,Accounting and finance,"Arabic: Mother tongue.,English: intermediate written and spoken.","Highly organized and efficient,Team worker,Proven leadership skills and ability to motivate,Ability to work under deadline pressure in a fast-paced environment,Problem solving,Willingness to learn new technologies,Good communication skills and interpersonal skills,Critical Thinking,Microsoft Excel,Risk Assessment"
158,424571,AL- ALBAYT University,Accounting,"Arabic as mother tongue,good command of English",excellent practice and knowledge Internet. Microsoft office suite(Excellent) Scala system Jana materials system FBM system MC system
159,423508,Al-Ahlyeh Amman University,Accounting,Unknown,"Accounts reconciliation,Bookkeeping,Data Entry,Data Analysis,MS Office & Excel,Numeracy Skills,Team Player,Self-Motivated,Attention to Detail,All Abdali Boulevard Christmas, Ramadan, and other events as an organizer and ushering team leader. ? Wedding planning and organizing as a team leader. ? Many other conferences and events as an ushering and organizing team leader. OTHERS: Mixed martial arts trainer (MMA) such as: Capoeira, Boxing, Kickboxing, Muay Thai & Jiu Jitsu."
160,565890,University of Jordan,Accounting,"Arabic: Native Language,English: Very good","Good at Microsoft Office (Word, Excel, PowerPoint).,Successful working in a team environment, as well as independently.,The ability to work under pressure and multi-task.,Can adapt with any new situation."
161,561791,Zarqa UNIVERSITY,BSc Computer Science,"ARABIC: FLUENTLY,ENGLISH: INTERMEDIATE",Problem solving and time management
162,475570,Al- israa University,Accounting-,"Arabic,English","Database MS Office,Testing,Networking,Ticketing,Teamwork,Social Media,Quick Lerner,Administration,Troubleshooting,Time Management,Ability To Work Under Pressure"
163,723723,"sagesse,sagesse university,Aku university fanar","finance,finance and banking,Accounting and finance","Arabic Level: Expert,English / Level: Expert,French / Level: Expert","Microsofot word and excel/Level: Expert,Accounting Bookkeeping / Level: Expert,Visual dolphin software / Level: Expert,Socrate sofware / Level: Expert,Matrix software / Level: Expert,Microsoft outlook / Level: Expert"
164,568750,"Jordan University (JU),",Accounting,Unknown,"Accountability,Adaptability,Communication,Customer/Quality Focus,Inclusiveness,Leadership,Occupational Knowledge,Technology Orientation,Team Focus,Time Management Skills,Organizational Skills,High Communication Skills,Negotiation Skills,Team Player,Problem Solving Skills,Reporting Skills"
165,431612,"Jordan University of Science and Technology,Al-Hassad Schools","Software Engineering,Scientific Specialization","Arabic,English","MS Office Word,MS Office Excel,Java Developer,Databases,DM Software,HTML,CSS,SQL,C++,Mena Track"
166,446359,Al-Balqaa Applied University,Accounting Information System,"English: V.Good in writing, reading and speaking.","Proceed the new employees record to HRIS system.,Update employees records and prepare monthly payroll transaction.,Work with payroll accountant to check the accuracy of payroll records.,Familiar with the technology updates that related with financial affairs (Microsoft Office applications ERP Applications\ Online apps & E-business sites).,Good knowledge in tax law, NGOs reporting environments & financial regulations international standards.,Good communication skills &Teamwork player.,Ability to work under pressure.,Good Analyzing & planning skills.,Self-confident fast learner."
167,409902,"Al-Balqa Applied University,AlQuds College",Accounting,"Arabic: Native Speaker,English: Very good","deliver accurate outputs within the minimum required time,learn, develop and share knowledge,AP full cycle (PO, Suppliers reconciliations, reports, cash flow management and payments),Cost management (Cost Variance Analysis & Expenses Control),Daily Sales Audit (ensures accuracy and completeness of POS entries vs actual, rectify if required),Import Clearing and Costing,Bank, Cash, Card, Gift Voucher and Credit Note Reconciliations,Territory Finance Assurance Reports,Month-End closing,Tax Endorsements (Sales, Salaries and Withholding tax),Ensures correctness and completeness of supporting documents for JVs,Payroll and social security,Bank reconciliations,Oversees the companys cash position and ensures that the general ledger and bank records are consistent,Check the trial balance and points out any discrepancies,Assist with quarterly and year-end closing and in preparing year-end account analysis, adjusting entries, and any other item necessary for the annual audit,Assist in analyzing financial information and in preparing financial reports to determine or maintain records of assets, liabilities, profit and loss, tax liability, or other financial activities within the organization,Follow-up and document significant variances ""Budget vs. Actual"",Daily Accounting entries,Sales Tax Endorsements,Microsoft Office; Advanced Excel Formulas and monitoring,General ledger, profit and loss,Critical thinking,Decision-making,Problem-solving,Excellent mathematical skills,Data analysis,Time management,Organizational skills,Detail-oriented,Supervision,Knowledge of regulatory standards,Effective communication"
168,442488,Yarmouk university,Accounting,"Arabic,English","Detail-oriented,development analytical skills,Microsoft office,Work under pressure,Sales,Solving problems,Team building"
