,CANDIDATE_REF_NUM,UNIVERSITY,EDUCATION,LANGUAGES,SKILLS
48,417834,Unknown,Information Technology,"English,Arabic","Configuration of cisco routers, Summarization, Router ID, DR, BDR, etc. IR, BIR, ABR, ASBR, LSA, Redistribution, Route-map, LSAs, Stub area etc. using RIP, OSPF, BGP, EIGRP. Experience with Cisco and Huawei Switching technologies, like, STP, RSTP, MSTP, VLANS, MLS etc. Port Aggregation/Ether Channel (Layer 2 and 3) etc.,Supporting in Presales by Delivering presentations to prospective and current clients. Managing the sales bid process by responding to RFIs & RFPs. Assist Sales Team in Qualifying Prospects by helping in the Tenders management especially to US Federal Government as well as Commercial Customers. Also handling Post-sales services like RMAs, Licensing and other related issues.,Hands on Experience on Microsoft Windows Server 2012 and 2016 Active Directory Domain Services, AD Group policies, Security Policies and Access control etc.,Installation and maintenance of Voice over IP system Desk phones, Wireless phones in Cisco, GigaSet, Mitel Telephony, Yealink and Unified Communication system.,Support of Office 365 with a focus on Exchange, Skype for Business and license management.,IT Services management and Service Desk Manager (CASDM) and POS Ticketing system.,Procedures laid down to ensure quick resolution for IT faults or incidents reported.,IT Networks and Desktop Support including 0365, VOIP Support and Ticketing Systems.,Ability to troubleshoot and resolve complex problems.,Client Server Architecture Support including Remote Access troubleshooting and resolution.,Acquired and utilized acute knowledge and troubleshooting experience with telephone equipment; and produced ad hoc reports and documents for senior team members.,Excellent Written and verbal communications skills in English. Also, fluent in Arabic language.,Responsible for LAN and WAN networks support along with other technical support.,Resolve 1st and 2nd line support incidents on the network, VOIP phones, workstations, printers & mobile devices.,VoIP Infrastructure Administration like Insta"
49,757275,Al-Balqa Applied University,Mechatronics Engineering,"Arabic,English","Self-motivated and ability to take the initiative.,Work under pressure.,Good administrative and organizational skills.,Work effectively as team member.,Good communication skills both in oral and written.,Complex problem solver.,Python,C++,PLC,MS Office,Project management"
50,623308,Philadelphia university.,communication and electronic engineering,"Arabic (Native language).,English (Very good).","Creative.,Team work play.,Time management.,Computer skills."
51,809695,AL AL-Bayt University,Geographic Information System and Remote Sensing),"Arabic,English","Design and production of maps,Geographic database management,spatial data analysis,Making apps in gis,sense of responsibility,Strong communication skills,Work under pressure,Time management,Team work,Strong presentation and negotiation skills,Strong communicating and client interaction skills,Contacting and communicating with high end decision makers,Able to quickly understand customer needs and to deliver timely and cost-effective solutions,Html,Python,Microsoft Office (Word, PowerPoint, Excel-Access),Google maps"
52,419469,AL-BALQAA APPLIED UNIVERSITY,communication and software,Good English performance,Computer (Microsoft office) & Internet Typing
53,808772,University of Jordan,Electrical Engineering,"English,Arabic","Team Leader,Flexible and innovative,Patience, Great ambition,Quick learner,MS Office 365,Basic computer architecture,Troubleshooting,Customer service,Routing concepts,Permissioning,Package and software management,Process management,Resource monitoring,Systems administration,Configuration,Centralized management,Implementing/managing directory services,Data management and recovery"
54,760457,Hashemite University,Computer Engineering,"English - Very good,Arabic - Native Language","Troubleshooting Cisco networks and isolating problems from switching side. Troubleshooting and knowledge in all kinds of Cisco catalyst switches for connectivity, CPU, hardware, and other software issues like system upgrades. Troubleshooting and understanding different protocols like DHCP / ICMP/HSRP/ARP/STP/VTP/ ( PAgP and LACP) CDP/NAT and ability to understand new protocols or technologies. Troubleshooting and knowledge virtual systems (VSS, stack wise virtual) and stacking systems. Collaboration with different technical teams in order to resolve issues. The ability to deal with all kinds of networks from the most complex to the most simple ones. Keep up to date with new technology products ion order to provide support as soon as they are lunched in market. Cooperate with the development team and business units to document and solve software defect through lab simulations and testing.,Worked on solarwinds solution As Network Operation Center for All Dar Offices. Worked on LogRhythm solution As Security Operation Center for All Dar Offices. Cisco Routing and Switching. Cisco Unified Communication Manager. Cisco Wireless Controller. Fortigate Firewall. CCTV Cameras system.,CCNA Routing and switching certificate. HCIA routing and switching certificate. CSFPC certificate. NSE1,NSE2 Certificate. Have a good knowledge about 5G technology. Linux online course. A+ course & maintenance skills. C++, SQL, verliog &assembly. Ability to learn new programming skills and technologies in a short time. Excellent team working skills. Creativity & problem solving skills."
55,555627,Al-Balqa Applied University,Communications and computer networks,Unknown,"Project Management,Leadership,Self-motivation,learn fast and work under pressure"
56,760359,University of Jordan,Business Information Technology,"Arabic,English,Spanish","Communication Skills,Work under pressure,Problem Solving,Networking design"
57,805133,Philadelphia University - Amman - Jordan,Computer Science & Computer Information Systems,Unknown,"Technically minded,Analytical,Pro-active,Problem solving oriented,Team player,Results oriented,Maintaining maximum availability of supported services for users.,Identify and recommending improvements for applications, Microsoft windows systems.,Research and recommend web-based solutions, to aid the business advancement transformation to web-based business model insuring flexibility and dynamicity.,Contacting IT software/hardware/Services suppliers and obtaining quotes to insure uninterrupted IT service.,Use cloud-based solution (executestrategy.net - CASCADE) to create & manage a dynamic digital form of companys strategic plans (short & long term), which includes:,1) creating a digital representation of all employees structure based on actual hierarchy.,2) adding all employees goals for a specified period(s).,3) aligning the company strategic goals (short & long terms) to each employee from top-to-bottom: General Management, Department Heads, Line Managers, Employees.,Problem-Solving and Administration.,Networking, VLANs, and network infrastructure.,Cloud services management.,Business workflow automation.,Security and Monitoring.,Account access management.,Hardware management.,Backup & Disaster Recovery."
58,755772,Al-Balqa Applied University (BAU),Computer Science,"English,Arabic","Switching & Routing,Network Access,Android,Java,Public Speaking,Negotiation"
59,825699,Hashemite University,electrical engineering,"Arabic: Native Language,English: Speaking, reading and writing","Teamwork,Problem Solving,Good communication skill,Excellent use of computer,AutoCAD Program,Assembly Program,Bluesol Program,Matlab Program"
60,820561,Jordan University of Science and Technology,Network Engineering and Security,"Arabic,English","Advance Knowledge of routers, routing protocols Programing Languages :(c/c++, python) Hands on experience on Linux operating system,Strong communication and organizational skills Problem Solving Flexibility Strategic planning Demonstrated interpersonal skills commitment"
61,463103,Applied Science University,Computer Science,"Arabic,English","Team work, Individual work, Work under pressure, Office work, Hardworking, Self-Motivated. Time management, Fast work, Productivity, Communication Skills, Creativity, Leadership, Flexibility, Responsibility."
62,721445,Al-Balqa Applied University / FET,Telecom Engineer,English - Very Good,"Microsoft office, AutoCad, Python, C++, blynk, fritzing."
63,675787,"Philadelphia University,",Business Networking & System Management,"Arabic,,English","EXCELLENT PRESENTATION SKILLS,EXCELLENT INTERPERSONAL SKILLS,A TEAM PLAYER WITH ABILITY TO WORK INDIVIDUALLY,STRONG EYE FOR DETAIL,ABILITY TO MEET DEADLINES,TIME MANAGEMENT,ABILITY TO DISTRESS WHEN WORKING UNDER PRESSURE,DRIVING LICENCE"
64,734685,Jordan University of Science And Technology,Computer science,Unknown,"HTML CSS java Script,Python Networks MS Office"
65,481498,Al-Balqa Applied University / Faculty of Engineering Technology/ 2015-2020 / Rate is Very Good [ 3.04 ].,Telecommunication Engineering,"Arabic - Native Language,English - Good (writting, reading and speaking).","High Ability To Work Under Pressure.,High Ability To Work With Team-Leader.,Very Good Time Management.,Good Communication Skills and Interpersonal Skills.,Fast To Learn.,Problem Solving."
66,807675,The Hashemite University,ELECTRICAL ENGINEERING,"Arabic: Native language.,English: Very good (TOEFL iBT =90 (out of 120)).","PV systems,Lighting and power systems,Program and operate a VFD,AutoCAD,PVsyst,DIALux evo,Packet Tracer,CODESYS,MS Office,Multisim,MATLAB"
67,753178,Faculty of Engineering Technology FET - Hashemite University,Electrical Engineering,Very Good Arabic and English,"Advanced Skills and knowledge in Excel, Power Point,Very Good in PV Syst, AutoCAD, STK and MATLAB"
68,825686,"Tafila Technical University,AL Balqa Applied University/Faculty of Engineering Technology",Electrical Power Engineer,"Arabic - Native,English - Very good","Energy Audit,Hard worker and fast learner.,MATLAB,Oral and written communication skills.,Arduino,Customer service skills.,Proteus,Critical Thinking.,C++,AutoCAD,MS Office.,IOT,KNX Protocol"
69,805888,"Al-balqaa applied university / Al-huson University Collage (2017 - 2021),",computer science,"Arabic: native,English: very good at writing, speaking, reading and listening","Excellent skills in C++.,HTML5 Programming.,CCNA. Router and Switch knowledge.,Knowledge in SQL.,Operating System: Windows.,Computer software and hardware installation and maintenance.,Excellent skills of using Internet and Microsoft Office Applications,Professional in Access, Word, Excel, PowerPoint.,Excellent analytical and Organizational skills.,Good Communication skills, good presentation skills.,Ability to work in a group or individually according to the job requirements.,Good Project Management, Problem Solving ability, and decision making ability.,Commitment and ability to work under pressure.,Quick learner and able to concentrate and pay attention to details."
70,513487,Yarmouk University,Engineering Technology,Good Conversational English,"New sites installation ""A to Z"" for any company or manufactures.,BTS & MICROCELL installation and expansion for HUAWEI and MOTOROLLA,Microwave links installation using (RTN910 and RTN950 modems) and (Andrew dishs ""from .3m to 3m diameter "") with configuration using ""Web LCT program"", and make troubleshoots if needed.,UHF Antenna installation, maintenance, and expansion ""include using (site master) to measure the VSWR "".,Civil works as install DPs & Mounts, Tower maintenance, Shelter build and maintenance, cable tray installation And maintenance,Fiber optic ""good experience"" by taking SDH project in south of Jordan with Zain and self-study as application, history, transmission and receiving, amplifiers, wavelength division multiplexer, types of fiber, attenuation, and ""advantages and disadvantages"",BTS cabinet ""Huawei 3900"" installation with all auxiliary equipment understanding the function of most equipment that include ""as BBU and WMPT cards"". With standard required from ZAIN and Huawei.,Knowledge of Mat lab, C++.,Highly proficient at Access, Excel, Word & Power point."
71,796369,YARMOUK,ELECTRICAL ENGINEERING,"ARABIC: NATIVE,ENGLISH: ADVANCED","Teamwork and Team leadership Superior communication skills Time Management,MS office professional GAIA, DEWAN and AMS systems Google Earth and GIS APPS Problem Solving"
72,514722,Yarmouk University,Communication Engineering,Very Good in English & fluent in Arabic which is my mother tongue language,"Excellent Experience in IP Addressing.,Excellent knowledge in Cabling.,Managing & Configuring Cisco Routers (1700 / 2521/2860/5000) Series.,Managing & Configuring Cisco Switches (2960/3500) Series,Configuring VPN Links.,Configuring Broadband Routers.,Configuring WAN Links such as (DSL / Frame Relay / ISDN/Y-MAX),Configuring & Securing Wireless LANs.,Publishing Local Services.,Managing & Configuring Wireless Technologies (A/B/G/N).,Configuring & Managing Networks running Windows Server 2008/2012 Domains.,Managing NAS (Network Attached Storage).,Overview on MS Exchange Server.,Managing Hosting Accounts and Domain Names.,Managing & Configuring Firewalls such as (ISA Server 2004 / 2006).,Building Network Documentation Documents.,Building User Manuals & Help Tools.,Excellent Knowledge in Computer Hardware / Software.,Very Good in Troubleshooting Problems.,Excellent in Managing Microsoft Operating Systems (7, 8, 10).,Very Good in using the Microsoft Office 2007/2010,Basics of using Apple Mac & Linux PCs.,Self-Motivated.,Excellent in Managing Time.,Very Good Management Skills.,Excellent Presentation Skills.,Good in Team Working.,Works under very high levels of pressure.,Very Good Experience in writing Business Letters, Offers & Proposals in both English & Arabic languages."
73,808356,Applied Science Private University,Electrical Engineering/Communication & Computer,"Arabic:,English:",MATLAB Assembly Arduino AutoCAD C++ Java Microsoft Office
74,785948,Al-Ahliyya Amman University,Networking and Information Security,"Arabic, Mother tongue.,English, very good writing and speaking.","Qualified in CCNA and CCNP Security.,Able to use Splunk SIEM Solutions.,Proficient in using more than one operating system.,Knowledge in more than one programming language.,Organize a workshop on Eve_Ng Network Emulator.,Organize a workshop on Virtualization.,Participated in the universitys open day event."
75,517110,Unknown,Unknown,"Arabic,Engilsh","Communication Skills,Team Work,Hard Work,Problem Solving,Time Management,Using Time Effectively"
76,799868,AL-BALQAA APPLID UNIVERSITY - IRBID,Computer Networking And Telecommunications,Unknown,"C++ TCP/IP, Vtp, VLAN, VMware. Routing & Switching SQL CCNA PMP Fiber To The Home (FTTH) activation & technician Fiber To The Building (FTTB) activation & technician. Voice Over Internet Protocol (VoIP) activation. Oracle Software"
77,809759,AL-BALQAA APPLID UNIVERSITY - IRBID,Computer Networking And Telecommunications,Unknown,"C++ Excellent,SQL Excellent,CCNA Excellent,PMP Very Good"
78,755378,Al-Balqa Applied University/Faculty of Engineering Technology,Computer System and Network Engineering,"Arabic (Mother Language),English (Good Writing, Reading and Speaking)","Work under pressure,Work with team. and interpersonal Skills,Effective Communication,Fast leaner."
79,530471,Princess Sumaya University for Technology,Communication Engineering,"Arabic (Native) | written and speaking.,English (Very good)| written and speaking.","Fortinet and Forti-products: FG, fortiAP, etc.,Veeam backup solutions.,Kaspersky.,Digital marketing and IT Solutions.,Wireless Typologies.,Cisco Systems Products: WLC, AP, Switches, Prime Networking and troubleshooting.,Telecommunications."
80,800319,"Really Great University,Really Great University",BA in Information and cyber security,Unknown,"Project Management,Problem Solving,HTML, CSS,,Java, Python,c++,c#,Sql,"
81,825646,The Hashemite University,computer information systems,"Arabic,English","patience, ambition, working,under pressure and keeping pace With technology constantly.,Assisting clients with their inquiries and questions related to the field of work,Format for computers of all kinds that support Windows,Training customers to use point of sale (POS) software,Adjust program settings to suit customer needs,Computer maintenance, including dismantling and replacing screens, hard drives, and RAM,Maintenance for printers, including changing the head and cutter,Define and change the IP of the devices and between them to connect them with each other,Download all necessary programs for customers to keep in touch with us and the system,Web Design languages:,Programming languages: SQL PHP, HTML, CSS,LAN & WAN ? Prezi,Microsoft Office,Quality Control,Teamwork ? Quick Learner,Communication Skills,Problem Solving"
82,438407,Al-Balqa Applied University/Faculty of Engineering,Computer Engineering,"Arabic (Native),English (Very good)","Confidence, team leadership, team work, social person Ambitious and adaptable to any situation for the job interested Attention to detail, good listener to advice and ideas Responsible, self-learning, hardworking, reliable and able to work hard under pressure"
83,755404,Amman Al-Ahlya University,network and information security,"Arabic: Native Speaker,English: Reading (Excellent), Speaking (Excellent), and Writing (Excellent)","A hard working technical professional.,Excellent problem solving skills.,Ability to prioritize and complete tasks in a timely manner.,Ability to work under pressure and handle multi tasks.,Ability to work well within a team.,Critical thinking and flexible and coordination skills.,Excellent communication skills.,Microsoft windows, Microsoft office ( word, excel.....etc)"
84,695462,Mutah University,Computer Science,"ARABIC,ENGLISH","Building and control panels? PIC - Duration (30),Computer skills and data entry - Duration (30),Digital image processing by MATLAB - Duration (30),Communication skills at work - Duration (30),Microsoft Office Skills.,Ability to work under pressure.,Working as part of a team,Ability to adapt to new environments,Development and programming of Android applications using languages (java/kotlin)"
85,619692,Tafila Technical University,Electronics and Communications Engineering,"Arabic: Native,English: Very good written and spoken","NOC engineer with +4 years of experience in technical support and customer service, Outgoing and detail-oriented, proficient at building and maintaining professional relationships."
86,803704,Al-Balqa Applied University Collega of Engineering,Electrical Power Engineering,"Arabic: Native Language.,? English: Very well in speaking, writing and reading.","PV Project Engineer.,PV Design Engineer.,Sales Engineer.,Installation of PV Systems.,PV Systems Testing and commissioning.,Dealing with the commissioing problems and find appropriate solutions.,Calibration of Monitoring and testing electrical devices and weather station sensors."
87,817822,"Balqa Applied University, Engineering Technology College",Communications and Electrical Engineering,"Arabic Mother Tongue -,English - Proficiently in Reading, Speaking and Writing",Autocad
88,754894,AL-BALQA APPLIED UNIVERSITY,B.SC. COMPUTER ENGINEERING,"Arabic :Excellent,English :Excellent","proficient in Microsoft Word and PowerPoint.,Computer and technology knowledge.,Knowledge in AutoCAD.,Programming languages: C++,Assembly.,Very good in OOP and data structure.,Oracle Data base Knowledge :SQL.,Knowledge in networks: CCNA course."
89,696224,Al-Balqa applied university -,Mechanical Engineering,"Arabic,English","Extremely eager on learning new skills and experience,Strong interest in new technologies and how they function,Excellent analytical and communication skills"
90,403515,"Mutah University,lakan AlMaliah",Communication and networking Engineer,"Arabic Native Language,English - Good speaking - Excellent writing and reading","Microsoft Windows Servers (2003, 2008, 2012, 2016) installation and configuration, Microsoft cluster services administration and configuration, Microsoft Windows XP, 7, 8.1,10 client installation and configuration. Microsoft Exchange server 2013 administration and configuration. Microsoft Domain Controller (2003, 2012) administration and configuration including: Active directory, DNS, DHCP. Manage all Hyper-v servers. Citrix System. Microsoft files and print server administration and configuration. Anti-virus Server administration and configuration. LAN Knowledge, Networking Knowledge, Network Hardware Configuration, Network Maintenance, Network Performance Tuning. Basic of Linux and UNIX system. Backup Systems. Helpdesk system built on ITIL Standard. DVR & Cameras Configurations CCTV Finger print systems. Power Generator and UPS systems.,Customers assistance,Quick learner,Complex proplem solver,Wide knowledge in computer software installing,Work under pressure,Innovative"
91,820888,"Balqaa applied university,AL-Balqa Applied University",Computer Systems and Networks Engineer,"ARABIC,ENGLISH","Hardworking,Work with team Work under pressure Communications skills"
92,773948,"Yarmouk University,","Communication Engineering,",Unknown,"Engaged with Cisco Technologies for networking hardware, and services. Managed Cisco configuration tool ""CCW"" and outlined designs according to client needs. Open Deals and get the Vendor discount. Solution design activates. Customer, vendor, and Distributor Engagements and negotiation skills. Help customers in preparing RFP, build the budget that meet their requirements.,good technical and Networking skills,Communication skills,Problem Solving skills,Ability to work as a team,Sales skills,Clients and vendors facing skills,Negotiation skills"
93,819910,Khulna University of Engineering and Technology (KUET).,Electrical and Electronic Engineering,"Bengali,English","IGP: Extensive hands-on working and troubleshooting experiences in OSPFv2 (Multi area, Multi process, virtual link, Sham link, LSA, route summarization, reference bandwidth, route filtering), IS-IS (Multi Level, Multi Instance, CLNS address, route filtering), OSPFv3, EIGRP & RIP. BGP: iBGP & eBGP configuration & troubleshooting. Different BGP attributes (Weight, Local Preference, MED, AS path pre-pending, Community etc) to manipulate best path selection process. Hierarchal Route reflector (RR) design for BGP route propagation.,Clear understanding on MPLS header and labels (transport label, VPN label). Signaling protocol: LDP, RSVP, BGP-LU configuration and trouble shooting. MP-BGP configuration& troubleshooting. VPN services: L3-VPN within the Autonomous System and between two Autonomous systems, L2ckt, L2VPN, VPLS, SATOP for TDM services. Protection: FRR (Node/Link protection), explicit MPLS LSP, R-LFA, LFA, BFD. Have understanding on Segment Routing.,VLAN (801.Q), QinQ (802.ad), Private VLAN, LACP (802.3ad), VTP, QoS (802.1P). Protection: STP (PVSTP, PVSTP+), RSTP, MSTP, ERP. Security: CAM table protect, Different STP/RSTP security, DHCP snooping, VLAN hopping attack & port security.,Hands-on working experience on Juniper SRX and Cisco ASA firewall. Security zones, Zone based policy, NAT & Port forwarding. Virtual firewall configuration and troubleshooting. Web filtering and Anti-Virus gateway. Site to Site IPSec VPN & Remote access VPN configuration and troubleshooting.,VRRP, HSRP & GLBP protocols configuring and troubleshooting experience.,Firewall Active/Standby failover configuring and troubleshooting experience.,PTP sync design.,Boundary clock, transparent clock and ordinary clock.,PTP related Datacom device configuration.,PTP over IP and PTP over Ethernet."
94,411693,Damascus University - Syria,Unknown,"English,Arabic,German","SQL Querying, and Optimizing.,Task Automation using Python scripts.,Windows Server and Virtual Machines management.,Network & Firewalls Management.,Full-Stack Web Development.,VOIP Server Administration.,Python,MS SQL Server,Web Development,Visual Basic for Applications,MS Office Suite,Databases and SQL for Data Science, IBM.,Python Development Course.,Google IT Automation with Python.,CCNA Switching and Routing.,Web Development Bootcamp."
95,550445,Zarqa University - Faculty of Information Technology,Information Technology in Computer Information System (CIS),Native English,"Microsoft Office - Outlook - Problem Solving - Team Work - Work under pressure,Image Editing Adobe Photoshop,Product Advertising Magento"
96,818903,"German Jordanian University (GJU), Amman, Jordan,Magdeburg-Stendal University of Applied Sciences, Magdeburg, Germany",Energy Engineering,"Arabic,English,German","Design of PV projects using SolarEdge and KWIX,Conducting renewable energy and energy efficiency studies,Support in energy audit,MS-Office,AutoCad,MATLAB,PSIM,Ltspice,PVSYST,DIAlux,SolarEdge,KWIX,SketchUp"
97,676130,(Balqa Applied University),Communication technology engineering Bachelor Degree,"Arabic,English","I got the CCNA course in PSUT University,I got the ICDL certificate.,I got an Arduino course certificate,Excellent in computer application,Good interpersonal skills and communication.,I trained in the Greater Amman Municipality / Wireless Communications Department"
98,599229,"Al Balqaa Applied University, Faculty of Engineering Technology",Computer Systems and Networking Engineering,"Arabic (native),English (very good)","Configure switches and end devices to provide access to local and remote network resources. Configure routers to enable end-to-end connectivity between remote devices. Configure VLANs and Inter-VLAN routing applying security best practices. Configure redundancy on a switched network using STP and EtherChannel. Configure WLANs using a WLC and L2 security best practices. Configure IPv4 and IPv6 statice and dynamic routing on routers.,Dedication,Fast learner,Effective leadership skills"
