,CANDIDATE_REF_NUM,UNIVERSITY,EDUCATION,LANGUAGES,SKILLS
99,823212,"The University of Jordan,",Computer Science,Unknown,"Wan routing protocols: OSPF, EIGRP, BGP and RIP. Wan technologies: MPLS, VPN, DMVPN. And NAT. LAN technologies: STP, PVST, Ether-Channel, ARP and DHCP. LAN redundancy VRRP and HSRP. Experience in all switches models (2960, 3560, 3750, 3850,3650, 4500, 6500,9500,9300,9200) and Supervisor (1, 1a, 2, 32, 720, RSP720, Sup2t, Sup6t). Experience in all SDWAN technologies like OMP, cloud-on ramp, DIA, and all transport and service level. Troubleshooting and implementing SDWAN controllers (vManage, vBond, vSmart). Experience with all edges model (vedge 100, vedge 1000, vedge 2000, vedge 5000, vedge cloud ISR1100, ISR4000, CSR 1000v). Experience in certification installation on all modes. Experience in centralized policy, localized policy and templates. Worked on multiple projects to implement sdwan solution form scratch. Experience in vmanage neo4j, cluster and Disaster recovery."
100,819117,"AL-Hussein Bin Talal University,",Electrical Engineering,"English,Arabic","Adapts well to changing processes and very eager to contribute to your company,Advanced English and Arabic skills in both, speaking and writing. Excellent computer skills.,Responsible for sales, dealing with customers and supplies."
101,754928,Al-Ahliyya Amman University,Networking and Information Security,"Arabic,English","Ethical Hacking Advanced Internet Protocols Networks Management Information Security Networks Programming Digital Forensics Encryption Theory Cloud Computing & Security Wireless Networks & Security,Thorough knowledge and understanding of TCP/IP protocol, OSPF, RIP, EIGRP, BGP NAT DHCP, DNS, DHCP Relay Agent, IPv4, IPV6, VPN, ACL, MPLS, LDAP, Kerberos, RADIUS, TACACS+, IGMP, ICMP, Subnetting, VLSM. Securing threats and vulnerabilities of networks, Ability to secure the system from hackers. Knowledge of common scanning tools such as Tenable Nessus and Nmap Firm. Strong cyber security, computer networking, operating system and desktop skills. Technical Support Professional in Computer Software and Hardware maintenance, Technical support Windows 7, Windows 8 Active directory, Windows 10, Windows Server 2016, Linux, Linux system Commands."
102,805300,University Of Jordan,B.A. IN ELECTRICAL ENGINEERING,"Arabic,English","Electrical contracting Experience in the field of home engineering installations and reading plans and home checks from problems of home consumption and its causes.,C++ PROGRAMMING NETWORK EMBEDDED SYSTEMS AUTOCAD MATLAB MICROSOFT OFFICE . ARDUINO,Good Communication Written Oral.,Problem Solver,Corporative With A Leader Personality,Good Team Worker,Excellent Conceptual And Analytical.,Good Team Worker,Quick Learner,Strategic Planning"
103,818619,Tafila Technical University - Faculty of Engineering.,Electrical Power & Machine Engineering,"Arabic: Mather Tongue,English: Good in Speaking and Writing","AUTOCAD.,Excellent in Microsoft Office Tools.,MATLAB (Simulink) [Self-learning] .,PLC Programming with SIMATIC STEP7.,Excellent Communication & Presentation Skills,Enjoy The Team Spirit and Great Ability To Work in a Team,Ability to Learn Quickly & Meet Deadlines,Hard Worker & Take Responsibility"
104,418938,Yarmouk University,Electrical Engineering,"Arabic,English","Autocad,MATLAB,Microsoft office,Driving license,Pyhton,C++,Self-learning using available resources,Very Good verbal and written communication skills in English,Ability to Work Under Pressure,Excellent troubleshooter,The ability to handle multiple issues in the most effective way"
105,735545,Al-Balqa Applied University (BAU),Software Engineering,Unknown,"Excellent MS-office command Exceptional communication and networking skills Successful working in a team environment, as well as independently The ability to work under pressure and multi-task The ability to follow instructions and deliver quality results Computer programming"
106,820999,"Mutah University,,Al-Hasania Secondary School",Electrical Engineering - Communications,English ?,"An active listener,Can work well on own initiative.,Reliable and able to work hard under pressure.,Able to take leadership appropriately.,Microsoft Excel,Microsoft Word,AutoCAD"
107,816925,Jordan University of Science and Technology (JUST),Network Engineering and Security,"Arabic,English","Packet tracer, Wireshark, Nmap, Snort,Windows, Linux,Python, c/c++, html/CSS,DNS, DHCP, TCP, UDP, RIP, OSPF, HTTP. Etc,Quick Learn,Self-Management,Teamwork,Confidence,Flexibility,Hard Work,Problem Solving"
108,818847,"Yarmouk University,Hashemite University","Wireless Communication Engineering.,Electrical and Computer Engineering.","Arabic | Mother tongue.,English | Very good.","Computer and programming skills Lego EV3 and robotics design MATLB and Python softwares Arduino programming. Familiar with LABVIEW Microsoft Visual Studio, Word, Excel, Visio and Power Point. Good using Cisco Packet Tracer and GNS 3. Very good experience in hardware and maintenance for PCs and printers, (A+ course). Excellent communication skills. Can work under pressure. Strong Management & Planning Skills. Initiative, motivated and target oriented. Ability of quick learning and adapting. Working either individually or in team works."
109,707869,Yarmouk University,Communication Engineering,"Arabic,English","Computer Science (Word, Excel,...),Communication Skills Team Worker,Problem Solver,Work under pressure,Time management,Multitasking,Statistical Analysis,Critical Thinking,Quality Standards,C++,Python,Matlab"
110,581885,Unknown,Telecommunication Technology Engineering,"Arabic: Native Language,English: Very Good","Team work,Communication skills,Team Leader,Team Building,Time Management,Always develops myself,Multi-task,Handling Pressure,Telecommunication knowledge,Networking knowledge,Computer skills,Microsoft Office Programs,Research Abilities,Teaching,Management the Social Media pages"
111,737934,Jordan University of Science and Technology,Network Engineering and Security,Unknown,"Security Technology Software LANS,C++/C Wireshark Packet tracer Android studio,Network systems installation Data backups Network security oversight Network repairs and maintenance Analysis. Effective communication Hardware knowledge System upgrades"
112,687787,YARMOUK University,"Communication Engineering,","German,Arabic: Native,,English: Fluent,,German: Level B1","WORK UNDER PRESSURE,C++, MATLAB, AUTOCAD,SOLUTION PROVIDING,TIME MANAGEMENT,TEAM WORKING,MICROSOFT OFFICE,COMMUNICATION"
113,800922,Al Balqa Applied University/2021,Computer Systems & Networks Engineering,"ARABIC NATIVE,ENGLISH","Networking.,Troubleshooting.,Security.,Monoitoring.,Linux OS.,Fast learner.,Team work,Virtualization."
114,764662,Al-Hussein Technical University (HTU),Electrical Engineering,"Arabic,English","Microsoft Tools,Performance Monitoring,Project Mangment,AutoCAD"
115,730978,Yarmouk University,Electronics Engineering,"Arabic,English","Strong knowledge of CCNA skills,PIC C language level(4),C++ Language level(5),Lt spice simulation level(4),PROTEUS simulation level (4),Multisem simulation level (4),Microsoft level (4),PCB designer level (3),Arduino language level (4),TCP/IP and IPv6,Packet Tracer simulation,GNS3 Emulators"
116,435349,"University of Jordan,Al-Hussein Technical University",Computer Engineering,"Arabic,English","Kali Linux,C++,SQL,C#,OOP,Web Page Design,MVC,MsOffice,Hard Worker,Flexibility,Quick learner,Time Management,Teamwork,Leadership"
117,419778,The Hashemite University,Computer Information Systems,"Arabic,English","Problem solving,Troubleshooting,CISCO Systems products,Unified computing systems,CCNA,Routing,Network Fundementals,CISCO IOS,A+,Switching"
118,422569,Al-Balqa Applied University /Al-Husson University College,Communication and Software Engineering,"Arabic (Mother Language),English (Good Writing, Reading, and Speaking)","Ability to communicate and interact withothers.,Ability to work under pressure.,Ability to persuade and negotiate.,Analysis and problem solvingskills.,Creative and openness for innovationand capability to implement bestpractices.,Data Analysis.,Resource Management.,Excellent command of Englishlanguage."
119,550389,"Tafilah Technical University (TTU), Tafilah-Jordan,Jubilee school, Amman-Jordan",electrical power engineering,"Arabic-Fluent,English-IELTS score 5.5(B2 Level)","Using Microsoft Office programs,MATLAB,AUTOCAD,Making calculation on electric circuits,Negotiation,Ability to Judgment and Decision Making,Time Management,Work under pressure"
120,817660,Philadelphia University,Electrical Engineering,"Arabic Native,English: Good","(PLC),AutoCAD,Microsoft office,Communication Skills & Teamwork.,Self-motivated and confident in working independently and as a team member.,Strong attention to details.,Personal Effectiveness & Time Management . Leadership Skills.,Flexibility"
121,741627,The Hashemite University,Mechanical Engineer,Unknown,"Microsoft office (excel, power point, word),IELTS Certificate (For English level),Adapt to a fast working environment,Analytical and communication skills,Certify of Presenting Social TV Programs from International Academy of Arts, Media and Creativity (IAAMC),Good knowledge in Cisco Certified Network Associate (CCNA) and Networking (self-study) and I am ready to take the exam (CCNA 200-301)."
122,544279,Al-Balqa Applied University / Faculty of Engineering,Network Engineering,"English Good.,Arabic Mother Tongue.","Data Analytics, and Visualization.,Database, and Data Preparation.,Research, and Self Learning Skills.,Analytical Skills.,CCNA"
123,818024,Hashemite University,BSc in Computer Science,"Arabic language,English language","Network Troubleshooting,Computer Skills knowledge such as Microsoft office,A good knowledge in pc Hardware component and troubleshoot problem,Ability to Work in a Team,Customer Service support"
124,811563,Jordan University of Science and Technology,Network Engineering and Security,"Arabic,English","C/C++, Python,Linux, Windows,Software (Packet tracer, Wireshark, Snort, Nmap),TCP/IP model, and its core protocols: (OSPF, DNS, SNMP, HTTP, etc.),Schematic & PCB Design,Problem Solving,Flexibility,Research,Leadership,Confidence"
125,808544,"(Bau) Balqa Applied University, Faquly Of Engineering",Electrical Engineering/Power,"Arabic: Mother Tongue,English: Excellent","MATLAB Electrical Engineering,Sketch-Up,Microsoft Office.,Multisim"
126,638893,AL-ALBAYT UNIVERSITY,COMPUTER SCIENCE,"ARABIC : NATIVE LANGUAGE.,ENGLISH: VERY GOOD COMMAND IN SPEAKING AND READING AND WRITING.","GOOD TIME MANAGEMENT,IWORK UNDER PRESSURE.,I LEARN QUICKLY.,TEAM WORK.,SALES & MARKETING.,CONTENT MODERATOR.,USING MICROSOFT OFFICE,ELECTRICAL APPLIANCE REPAIR."
127,612696,Unknown,Telecommunications Engineering,"Arabic,English,Chinese (Beginner)","2G, 3G, 4G, 5G Architecture IP Networking & Tools Troubleshooting Cloud Computing Big Data Tools MATLAB Multisim Python MS Tools"
128,753801,"The Hashmite University,",COMPUTER SCIENCE AND APPLICATIONS,"Arabic (Native), English (Fluent).","Fast Learning. Future Focused. Creativity and Critical Thinking. Problem-solving.,Programming: Python, Java, JavaScript, C++. Software: Photoshop, illustrator, After Effects, premiere, Vegas. 85+ WPM."
129,760255,Zarqa Private University,software engineering,"Arabic,English,Deutsch","Communication Skills.,Strong Networking skills, High ability to build and sustain relationships.,Good Interpersonal Skills.,Leadership & Good Team Working Skills.,Enthusiastic.,Creative.,Competent user of : Microsoft Office tools (Microsoft Word, Excel, Power Point & Access).,Familiar with photoshop CC2016.,Internet & the Emails writing skills.,java,C#,MYSQL,HTML, CSS, JavaScript, JQuery, JSON & BootStrap,Manage Activitie Directory."
130,754844,Jadara University,Software engineering,"Arabic, Native,English, Very Good","Microsoft office, very Good,C#, Very Good,Network, Very Good,java, Good,C++, Good"
131,819459,University of Jordan / Faculty of Engineering,Mechatronics Engineering,"Arabic,English","Electrical and Mechanical Maintenance Operating.,Computer Maintenance,AUTOCAD,MATLAB,MS Office,Proteus 8 Professional,CNC Simulator Pro,MPLAB IDE v8.92,Logix Pro,Hard Working.,Team Worker.,Effective Communication and Interpersonal Skills.,Able to grasp new concepts quickly and efficiently.,Adaptable,Flexible -- Willing to try new things, adapting with different work conditions and projects requirements while improving efficiency on assigned tasks..,Excellent verbal and written communication skill"
132,756772,Jarash University,Computer Networking,"Arabic,English","Skilled multitasker,Maintenance and repairs,FAQ updating,Network support,Overcoming problems or issues,Self-motivated,Well organized,Strong verbal communication,Process implementation,Microsoft Office"
133,825694,Yarmouk University,Electrical Power Engineering,"Arabic: Native,English: Good","Data entry,Self-Learning,Public Speaking,customer service,Dealing with customers,Hard Worke,Teamwork"
134,825697,"Jordan University of Science and Technology,","Electrical Engineer,Electrical Engineering/power and control","Arabic,English","Working knowledge of programming language C++.,Highly proficient at Access, Excel, Word & PowerPoint. Knowledge of AutoCAD,Matlab,Arduino,Developed ability to produce reports and presentations to a professional standard.,Proficient in assessing data and formulating solutions.,Effective at time management and prioritizing tasks to achieve deadlines.,Strong team working, leadership and communication skills.,Conversational Arabic (native speaker) and English (very good)"
135,407823,University-jordan.,Engineering of Communication and Electronic,Native Arabic and Fluent English (Spoken & Written).,"Technical skills The OSI & TCP/IP models, Frame Relay, MPLS. Cisco router and switch. IP Addressing, subnetting, Acls, VLAN, NAT, PAT. Network connectivity troubleshooting ping, tracert, telnet. TCP/IP Protocol: DNS, SMTP, DHCP, HTTP, FTP, SNMP, TCP, UDP,IP, ARP, ICMP. Routing protocol: RIP v1/v2, IGRP,EIGRP, BGP, OSPF. Wirshark, GNS3, Packet Tracer, troubleshooting Microsoft Office (outlook, excel, word). Security: Firewall, DMZ, IPM, IDM, VRRP, HSPR, GLBP F-Secure end point security solution. VPN IPSec, SSL, L2tp, PPTP. Wifi technologies.802.11/WLAN technology. Voice Over IP (VoIP) Technology. CCTV System. UCaas Technology. Active Directory. Cisco ISE. Analytics and Troubleshooting. Interpersonal skills ?Microsoft office utilities (excel, word, access and power point).,Good communication skills. Team work oriented Ability to work under pressure. Self-learning skills Familiar with all computerized system and prepare computer."
136,745339,"ALBALQAA APPLIED UNIVERSITY, FACULTY OF ENGINEERING",electrical power engineering,Unknown,"Proficient in finding and resolving malfunctions, using exceptional technical and communication skills.,Ability to express technical concepts clearly where appropriate.,An effective communicator with excellent interpersonal, logical thinking & analytical abilities.,Excellent communication skills.,Professional attitude towards work.,ICDL,MATLAB,MULTI SIM,AUTO-CAD,ELECTRICAL,INSTALLATION,DIAGRAM,HOME,INSTALLATIONS"
137,414619,Alzaytoonah University Of University,Computer and Communications Engineering,English,"Computer Networks (CCNA) use Packet tracer and Wireshark,Participated in lunching Alzytoonah IEEE branch which expanded my communication skills Expanded my programming skills and computer network written and verbal communication knowledge while using different open source platforms such as (udemy, coursera, edx and netacad)"
138,809447,University of Jordan,Electrical Engineering/General,"Arabic,English","Excellent knowledge: RAN, Core Network, CCNA, Fiber Optics, Mobile Technologies (GSM, 3G, 4G), Cloud Computing, Antennas, Digital Communication.,Entry Level Experience: Linux, Cisco UCS C-Series Server, Nexus 9k Switches, Cisco devices configuration.,Programming: C++, Assembly, MATLAB, Verilog HDL.,Software: Microsoft (Office, Excel), HFSS, Atoll, Multisim, AutoCAD, SketchUp, HOMER, PVsyst.,Communication, Self-Learning, Fast-Learning."
139,823612,Yarmouk University,Communications Engineering,"Arabic (Native speaker),English (Good)",Good Knowledge in Data structure and algorithms (C++) Good Knowledge in MATLAB Word/Excel/ LATTEX / Circuit Maker Effective Communication Problem solving Excellent team worker Fast learning High stamina to work under pressure
140,809171,Al Ain University,COMPUTER ENGINEERING,"Arabic,English","Database 90%,CISCO Switches Configuration 80%,Operating Systems 95%,Microsoft Vitual Studio 100%,Microsoft Office 100%,Computer Graphics 100%,Photoshop 70%"
141,824441,University of Jordan,Mechatronics Engineering,"Arabic | Native language |,English | very good |","Quick learner.,Hard worker.,Good Communication skills.,Good Teamwork skills.,Able to work under pressure.,Eager to learn new things.,MS Office,Auto CAD,MATLAB,Electronics Circuits Simulation,CNC software"
142,699796,Eastern Mediterranean University,"ELECTRICAL & ELECTRONIC ENGINEERING,Electrical and Electronics Engineering","Arabic,English,Turkish","Customer Relations,Team Player,Time Management,Problem Solving,Fast Learner,Self-Motivated,Project Planning,Strong diagnostic skills with electronics and X-RAY devices,Software Installation,Electrical Wiring,Electronics soldering,Devices installations,C Language,Microsoft Word,Microsoft PowerPoint,Python,Perfect Field services and devices installation,Public Speaking,Presentation Skills,Self-Confident,Product advertising skills,Open to new techs and fast learner.,Employee training"
143,577820,Al-Balqa Applied University,Network and Computer Engineering,Unknown,Unknown
144,505351,Yarmouk University,Communications Engineering,"Arabic (Mother language).,English (good speaking, writing and reading).","configure VoIP networks,install and configure TeleFinity call center,,call recording, IVR and billing systems.,recommend VoIP solution for short, long range Projects.,Working on Windows server 2019 less,Provide documentation, training, and guidance for each project during handover matching physical environment.,monitor systems performance, software and hardware upgrades, backups, tracing problems and maintenance.,Analyze data and submit report by SQL.,Inter-price projects, Price order invoice,,Distribution of work teams, Mange teams,,Material handling issues, Coordination and communication with customers, Technical support,Manage data services MDS.,FTTH Project for orange company.,Acquisition and audit of electricity meters.,2G,3G Projects ZTE equipment at Umniah company.,Installation, Configuration, Mange team,,Tracking root service and Maintenance,,Technical support,Manage data services MDS.,Installation, Configuration, Team leader,Manage data services MDS,Microsoft Office,Strong team working and analytical thinking.,Leadership, strong personality and supervisory skills.,Ability to work under pressure and tight deadlines."
145,759737,INTERNATIONAL UNIVERSITY MALAYSIA,COMPUTER SCIENCE,Unknown,"Data centers, presales, solution, design for enterprise, wholesale, cooperate customers,Networking, Network security,wireless technologies, Customer Design, cloud computing solutions, Telco Solutions.,LTE, 3G/4G/2G, RF planning, GSM, data roaming.,Planning, Installing and troubleshooting Telecoms systems.,Vendor: Cisco, juniper, Checkpoint, Palo alto, Fortnite, Aviatrix, Azure, AWS"
146,805996,Al Balqa Applied University (College of Engineering Technology),Unknown,"Arabic -,English","Freelance programming and website development,Design in more than one programming language,Network Administration,Work under pressure,Computational Research & Development,Html/pythone,fast learner,skilled at network configuration, technical solution development and technical infrastructure migration,time management and clear communication,working with teams,adaptability,speaking with people from various backgrounds"
147,529328,"Jordan University of Science and Technology, Jordan,Jordan University of Science and Technology, Jordan","Electrical Engineering specializing in Power,Electrical Engineering specializing in","English,Arabic","Able to think in mathematical and abstract terms,Knowledge of radio and microwave transmissions,Knowledge of Cisco routers and switches and LAN and WAN,Hands on building/engineering experience with IP based WANS, LANs, transport hardware and software,Experience with BGP, OSPF, IS-IS, and MPLS Routing protocols,Knowledge of Cisco SD-WAN,Familiar with M2000 program and WiMAX network,understanding of all OSI layers from application to physical,Familiar with MATLAB/Simulink, Microsoft visual C++,Programming of PIC microcontrollers in assembly language and C language,Computer skills: C++, MATLB/Simulink, AutoCAD, and MS-Office,Power system: power system analysis, contingency analysis, optimal power flow, economic dispatch, and unit commitment Renewable energy: solar energy system with two types including off grid and on grid, PV cell, and Maximum Power Point Tracking."
148,561194,Mutah University,Electrical Engineering,"Arabic,English","Communication Skills,Strong under pressure,Quick learner,Customer service,Goal oriented,Computer applications,Attention to details"
149,727642,"Al Balqa Applied University,",Power Electrical Engineering,"Arabic - Native language,English - very good","Preparing for International Software Testing Qualifications Board (ISTQB) Certification.,Classic Control and Programmable Logic Control (PLC).,Design of Solar Energy System.,Design and Implementation of Electrical Systems for Facilities.,E-tap workshop.,Microsoft Excel (Online course).,Microsoft Office Programs / Auto-Cad / Matlap / Dialux / Ecodial / Sketch-Up / PVsys / PLC LOGO.,Flexible person with the ability to work under pressure.,Engineering sense.,Communication.,Fast learner.,Teamwork.,Leadership."
150,821434,"University Of Jordan - Jordan, Amman",Electrical Engineering,"Arabic,English","Communication skills,Professional Documentation,Engineering Application Tools,. Ability to troubleshoot Wireless network issues with cisco Wireless devices.,Troubleshooting Wireless Network Issues,Cisco equipment familiarity,SDA fabric, and DNA,switching, routing, and security protocols,Mentor for new Engineers on the Wireless Team"
151,755528,"Mirpur University of Science & Technology,Corvit Systems Islamabad",Computer Systems Engineering,Unknown,"Deep understandings of Routing, Switching and MPLS Technologies with holding Expert Level certification.,Excellent in pressure tackling and working in under pressure environment,Highly Skilled, Motivated with positive working attitude Professional. Always keen to learn new technologies.,Routing Technologies: Hands on experience on 3isys (CS-5500/4900/5900 series), Cisco Nexus (9K),Juniper Qfx (10K,5K) series MPLS Technology MPLS LDP MPLS RSVP TE L3VP L2VPN(VPLS) Inter-As option,Switching and Bridging: VLANs, Inter-VLAN Routing and VLAN Trunking Protocol (VTP) First Hop Redundancy Protocols - HSRP, VRRP and GLBP Virtual Switch System (VSS)/Virtual Port-channel (VPC)/ Multi chassis Link-aggregation (MC-LAG) Link Aggregation Control Protocol (LACP) QINQ/dot1q encapsulations. Spanning Tree Protocol (STP) and its variants(RSTP and MSTP"
152,754684,"Al-Balqa Applied University,AS-Salt Secondary School",computer engineering,"Arabic,English","C++,Python,Networks,Arduino,MS office,Time manegment,Creative,Organized,Teamwork"
153,692655,Al-Balqa Applied University / Faculty of Engineering,Communication Engineering,"Arabic Mother Tongue.,English - Very Good","Simplicity & Perfection,Hard worker,Work under pressure,Good communicator,Well time manager,Ability to work effectively with people with different levels"
154,551017,"Al Balqa Applied University,",Computer systems and Networks Engineering,Unknown,Unknown
155,755420,"from Faculty of Engineering Technology (Polytechnic) at 2006,from Banking and finance Science University at 2008 in Jordan",Computer Information System (CIS),"Arabic:,English:","IPv4 & IPv6 connectivity.,TCP/IP protocols.,LAN and WAN Management.,Cisco routers and switches.,Broadcasting and telecommunications knowledge.,Installing and configuring operating system, and virtualized environments.,Perform operating system maintenance,Good abilities to understand SQL oracle by self-studies.,Good Knowlagent to SQL server and database.,Computer maintenance (hardware/software).,Excellent skills using Microsoft Office tools, Word, Excel, PowerPoint, etc.,Communication skills.,Team Work and Self Study.,Fast learner, with high IQ and logical skills.,Ability to work under pressure and creative personal.,Ability to analyze problems and deploying solutions within the limits available.,Social, cooperative and flexible."
156,687158,"JUST,Al shrouk High school",Network Engineering and Security,"English (Proficiency),Arabic (Native Proficiency)","Wireshark,Wireless Designs,C, C++,Bash Script, Python,Installation Network,Network Security,Firewalls,Teamwork & Public speaking"
157,760055,Jadara university,COMMUNICATION AND COMPUTER ENGINEERING,"Arabic,English","Problem-solving and Experimentation.,Working effectively with team members or individually and work under pressure,Doing the work in a timely manner.,Attentive to details and accuracies."
158,755427,University of Jordan,Computer Information System,"Arabic,English","Fast learner,Take initiative,Fast Adapting with a working Environment,Take responsibility,Team working"
159,818764,Unknown,electrical engineering,"English - intermediate,Arabic-native","Arduino,Communication / good,Electrical wiring,E-Marketing/Intermediate,Matlab,Self-motivation / Intermediate,Computer Skills / word - power point,Digital Marketing"
