,CANDIDATE_REF_NUM,UNIVERSITY,EDUCATION,LANGUAGES,SKILLS
0,417809,al Balqa Applied University,communication technology engineering,"Arabic,English","SQL Oracle,Motivation skill,Interpersonal relationship building,collaboration and team work,Matlab,CST,Link!,Multisim,Linux,Cisco packet tracer,Microsoft Group"
1,754751,Isra university,Computer Networks,Unknown,"Teamwork,Leadership,Problem-solving.,Adaptability,protocol,Switching,Routing"
2,816934,"Australian National University,NWFP University of Engineering & Technology,Australian National University,University of Engineering & Technology Peshawar Pakistan",Communications,Unknown,"GSM network monitoring and configuration using various Network Management tools,Configuration and monitoring on Switch Commander (Release 99) interface for Siemens D900 Switches,Configuration and monitoring using NetAct (Nokia Release-4) interface for Nokia DX200 Switch and IPA2800 MGW (Media Gateway),Configuration and monitoring on Siemens NetManager for Telenors Long Distance International (LDI) Network.,Monitoring on Huawei M2000 for Huawei ngHLR,Preventive maintenance and health checks on 2G/3G RAN elements and KPI analysis,Provide support to the field engineers and technicians/vendors in the integration of new network elements as well as in maintenance activities on the current nodes.,Logging Trouble Tickets using HP service desk and HP service manager and their timely and efficient follow up till resolution within agreed SLA,Coordination with other mobile operators and roaming partners for inter network traffic testing and resolution of faults.,Service provisioning and Assurance, Troubleshooting, Customer Support"
3,683704,"Al-Zaytoonah University,",power and control engineering,"Arabic: Advanced,English: Excellent",Creative design Innovative Service-focused
4,516345,Petra University,Unknown,"Chinese,Arabic,English","dealing with Linux systems terminal (entry level),ethnical hacking using kali Linux,installing and dealing with a major computer software and hardware,SAP ERP system (SD&MM) entry level,PHP, HTML, JAVA, ASP.NET, C#, C++,Bootstrap,SQL server,Mysql,Database analysis"
5,818269,"Yarmouk University,",TELECOMMUNICATIONS ENGINEERING,"Arabic | Native,English | Very good at reading, writing, & Speaking.","Good at MS. Office software.,High knowledge in responding to social needs.,Excellent at Customer Service Management.,Good marketing skills.,High networking skills.,Excellent negotiation skills.,Punctuality and Efficiency.,Flexibility & Positive Attitude in every situation.,Responsibility.,Ability to establish & maintain good work relationships.,Self-confidence.,Problem-solving.,High Communication skills.,Excellent Time management."
6,818362,"Al-Balqa Applied University,Faculty of Engineering Technology","Electrical Power Engineering,Electrical Power Systems","Polish language,Arabic language,English language","Understanding of electrical sciences.,Circuit wiring.,Problem-Solving.,Fast learning.,Communication skills.,Troubleshooting skills and attention to detail.,Computer literacy,Electric simulation programs."
7,402260,"Al-Balqa Applied University Faculty of Engineering Technology (FET) polytechnic,Al-Quds college","Electrical, Electronics and Communications Engineering,Electrical, Electronics and Communications Engineering",Unknown,"Learning,Teamwork,Leadership,Communication,Perform IBS site survey and prepare site survey report.,Understand the IBS design and lead the implementation team to follow the design.,Supervise IBS implementation technician.,Perform daily site visits to ensure that implementation technicians are following implementation standards and quality procedures.,Prepare IBS site folder documentation.,Perform periodic reporting on the daily and weekly implementation progress.,. Coordinate with site building management for access and for work plan.,Resolving RAN Customer Complaints and ensuring the best Quality of Service for RAN elements, as well as supporting the needed coverage and capacity growth wireless networks at Zain Jordan 6th month as a trainee from Jordan Engineers Association."
8,670008,The Al-Balqa University,Communication Engineer,"Arabic: Native speaker (Mother Language).,English: excellent in communicating, reading, and writing.","Excellent communication skills and the ability to deal with different kinds of people/work on a team.,I can work under pressure without negatively affecting my work.,Strong individual performance.,Excellent Collaboration skills.,Excellent general computer skills."
9,760081,AL-Balqa Applied University,Telecommunication Engineering,"Arabic: Mother Language,English: very good","Time Management.,Work under pressure.,Teamwork spirit.,CCNA knowledge"
10,434829,Princess Sumaya University of technology,Telecommunication engineering,"ARABIC,ENGLISH","Troubleshooting ETTH and FTTH problems.,interfacing with some apps like Hawaii Software-U2000.,Provide feedback to the management concerning possible problems or area of improvement.,Working on Analog and IP cameras system.,Testing and Troubleshooting CCTV system.,Installation, configuration and Running the voice system.,Work with team member and the managers to complete the duties as needed,Installation and configuration VoIP System,maximize network performance by monitoring performance, troubleshooting network problems and outages, scheduling upgrades and collaborating with network architects on network optimization.,undertake data network fault investigations in local and wide area environments using information from multiple sources.,provide remote support to on-site engineers and end users/customers during installation."
11,543960,University of Jordan,electrical engineering,"Arabic Mother Tongue,English fluent listening, writing and speaking","Install, configure and support LAN/WAN projects for organizations. Configuring and supporting firewalls, Deploying firewall policies and security profiles, monitoring network applications and blocking events, and configuring VPNs. Install, configure organizations on-premises wireless LAN infrastructure including Access Points and Wireless Controllers. Provide support and troubleshooting to customers different network and endpoint security technologies (Switches, Routers, Wireless Controllers, Firewalls). Perform health check and periodic preventive maintenance (CPU, memory, RAM and hardware) for different network and security infrastructure. Prepare technical documentations and reports for projects.,MS office Linux MATLAB AutoCAD SQL C Programming Language Python Programming Language Basic working knowledge of virtualization environments including: VMware and Hyper-V (Windows and Linux). Basic working knowledge of writing Linux Scripts.,Verbal and written communication skills. Troubleshooting. Problem Solving. Team worker. Adaptability. Creativity."
12,820171,"Jordan University of Science, and Technology",Computer & Information Technology,"Arabic,English","understanding of OOP, Data Structures, Algorithms, Design Principles.,Exposure to ITIL Foundation.,CCNA equivalent experience,Active Directory GO,OU,Pfsense firewall rules.,troubleshooting hardware peripherals.,configuring and troubleshooting Vmware technologies,Fingerprint and access card technologies (Virdi, Kantech),Collaboration technologies Mailbox, IVR, SIP, SCCP, AXL integration,Positive attitude, hardworking and teamwork,Strong analysing skills,Good understanding and communication skills,Excellent judgment and creative problem-solving skills.,Work under pressure hardly"
13,746696,جامعة الطفيلة التقنية,"تكنولوجيا التصنيع المحوسب Diploma,تكنولوجيا التصنيع المحوسب","English,Arabic","العصف الذهني,Dedication,Business Organization,العمل بروح الفريق"
14,817790,"Tafila Technical University, Tafila, Jordan",Communications and electronics Engineering,"Arabic [mother language],English [ speaking, writing, reading]","Highly developed communication and reporting skills. Strong communication skills: (Interpersonal skills, administrative reporting presentations). Computer proficiency (word processing, presentations & e-mail correspondence). Hardworking & team player. Accountability and commitment. Programming electronic devices; Such as Raspberry Pi ( at Jordan engineers association) (certificated) CCNA (at cisco - Tafila) ( Certificated).,Assist the lab supervisor in different labs.,Control students during the examination period.,Carry out some tasks at the admission and registration department."
15,758870,The University of Jordan,Electrical Engineering,"Arabic,English","MATLAB, Python, C++,ANSYS HFSS, Atoll, ETAP, Multisim, Wireshark,Proficient in Microsoft Office Suite"
16,816794,Private University,"Computer Science,Energy Engineering","Arabic - Mother language,English - B2,Deutsch-Good (B1 level)","Microsoft Office package, Java, C Language, HTML, CSS, Java Script, Python, Flutter, Database, PVsys, PVsol, Revit."
17,632650,Government College University,Electrical (Telecom) Engineering,Unknown,"VOIP: Understanding of all major formation techniques (Routing, Troubleshooting etc.) By using different Software`s Switches e.g. SONUS, GENBAND, DIGITalk, Itel, Voss, SIPPY, NEON. Technical Skill : Understanding of PCAP traces, creation accounts, define rating plans, Balance addition detection, Creation technical reports,,Relevant Course Studies: Digital Signal Processing(DSP), Satellite Engineering, Optical Fiber Communication, Wave Propagation and Antennas, RF & Microwave Engineering, Wireless & Mobile Communication, Digital Communications, CCN (Computer Communication Network."
18,661549,De Montfort University,Electrical and Electronics,Unknown,Unknown
19,817457,"Arab Academy for Science, Technology & Maritime Transport",Communication,"Arabic Fluent,English Very good","Ability to work under pressure.,Self and fast Learner.,Good Communication Skills.,Hard worker."
20,755133,University of Science and Technology,"Communication Systems,Communication Systems Engineering","Arabic: Native,English: Good","Analytical and troubleshooting abilities.,Operating system (Windows, Windows server, Linux & MacOS).,Ability to follow-through and react quickly to situations.,Excellent telephone skills and good ability to use Remote Access.,Server management.,Systems administration.,Microsoft Office 365.,Adobe photoshop.,Outlook and emails configuration & troubleshooting.,Ability to diagnose networks, computers, copiers, CCTV, and phone systems (VoIP)in an efficient and professional manner.,Ability to create and supervise computer applications and system upgrades (viruses, application glitches, and hardware issues).,Detail orientation, technical details, following established processes and assisting with the development of new or changes to support processes.,Comfortable working by my own or part of a team,Ability to disconnect all network devices and phone system, transport them and reinstall them at new locations during office relocations,Ability to install PBX phone systems,Ability to troubleshoot network, CCTV and voice cabling (Digital or Analog),Experience in Structured Cables installation,Ability to develop myself and gain new skills,Ability to climb ladders and maneuver in attics and/or crawl spaces when necessary,Provided support to customers via email or phone and resolved any IT related issues,Design, implement, install, configure and troubleshooting Microsoft windows server,Administering Windows Server networks, domains, roles and services,Troubleshooting and maintenance Active directory, DNS and DHCP,maintained physical server hardware and performed repairs when needed,Implementing, Managing and Monitoring Network Devices"
21,693923,Al-Balqa` Applied University,Telecommunication and Software Engineering,"Arabic Mother tongue,English Professional","Expert in MATLAB,Expert in C++,Expert in Multisim,Expert in CST suit,Good written and verbal communication skills.,Excellent team leading and coordination skills."
22,432923,Princess Sumaya University for Technology,Electronics Engineering,"English,Arabic","Good Communication Skills,Teamwork,Troubleshooting,Flexibility,Customer service,Critical thinking,Work under pressure,Time management,Quick leaner,Design Techniques,Software Installation,Testing Cables,Site Surveys,Integration,Programming,AutoCAD,Cables & switches,Routers,LAN,IPv4 & IPv6 routing,Infrastructure technology,TCP/IP"
23,512689,Al-Zaytoonah University of Jordan.,Communication and network engineering,"Arabic (Mother Language),English (Write and Read ) very good.","Design and implement functional networks.,Configure manage and maintain essential networks devices.,Use devices such as switches and routers to segment networks traffic and creat resilient networks.,Identify benefits and drawbacks of existing network configurations,Implement network security standards and protocols.,Troubleshoot network problems.,Support the creation of virtualized networks.,Implementing Cisco IP Swiches Networks.,Plan and perform regular maintenance on complex enterprise routed and swiche networks.,Good interaction with team.,Work under pressure.,Have a good personality.,Experience with AutoCAD.,Good use internet and Microsoft Office.,MATLAB & JAVA & C++,Kotlin language"
24,756770,Zarqa Privet Universitty,computer information systems,Unknown,"Exceptional communication and networking skills,SQL Database,The ability to follow instructions and deliver quality results,The ability to work under pressure and multi-task,Successful working in a team environment, as well as independently"
25,817447,"Modern Academy (For Engineering and Technology),",Communication and electronics engineering,Unknown,Unknown
26,755678,"Isra Private University,Balqa Applied University","Electronics and Communications,Electrical Power Systems","Arabic: mother tongue,English: very good (reading, writing and conversation).","Social Skills and Competences General soft skills (presentation skills, planning, team work skills).,Technical Skills and Competences The passion to read tutorials, document, manuals and scientific papers. Analytical thinking skills."
27,754848,The Hashemite University,Electrical Engineering,"Arabic- Native,English- Bilingual,Arabic,English","Good Listening Skills,. Excellent Work Ethic,Capability to Analyze Data,Flexibility,Solving Complex Problems,Communication Skills,Creativity,Teamwork,Organization Skills,Python PvSyst Matlab Microsoft Excel AutoCad"
28,819140,Institute of Aviation Engineering and Technology (IAET),Electronics and Communication Engineering,"Arabic,English","Good Communication Skills,Motivated and Organized,Problem solving,Research and Development,Work under Pressure,Access & configuring all network devices (Routers, switches) with Full privilege for troubleshooting,Troubleshooting and investigating core routing protocols problems (OSPF -BGP - MPBGP L2/L3 VPN - LDP) services on routers,VMware Workstation,Office Skills (Word, Excel and Power Point),Operating System (Windows, Linux(CentOS)),Establish the networking environment by designing system configuration and directing system,Configure routing and switching equipment"
29,825690,Jordan University of Science And Technology,Electrical Engineering (Power and Control),"Arabic Mother language,English Writing and Reading is excellent with good speaking","Fast learner, able to learn new systems,Active team member,Manage time,Good Communication Skills,Strong Work Ethics"
30,744535,World Islamic Sciences and Education,Software Engineering,Unknown,"C#,ASP.Net,MVC,HTML,CSS 3,Bootstrap,SQL Server,Java,Microsoft Office,X++,SQL"
31,406990,Al-Balqa Applied University.,Communications Engineering,"Arabic,English","Research skills,Analytical skills,Teaching Skills,Communication skills,Microsoft Office,MATLAB,NI Multisim and LabVIEW,Cisco Packet tracer,Information Technology,Communications Technology"
32,755308,Al-Balqaa Applieduniversity,communication engineering,"Arabic,English","MATLAB advance training andSimulink.,Google sketch up and PVSYSTexperience.,Adobe photoshop andillustrator.,Microsoft office andExcel.,VBAprogramming.,Fixing any issue onnetworks."
33,816846,Yarmouk University,Unknown,"Arabic language (Mother tongue),English language (Excellent user and speaker)","Very Good communication skills,Excellent at using the Cisco Packet Tracer program,Excellent command in dealing with all the computing programs,Very good in using the social media applications,Excellent in dealing with network and network security,Ability to deal with using good soft skills"
34,818115,"Al-Balqaa Applied University,",Communication Engineering,"Arabic,English","Time Management & Productivity.,Communication Skills.,Problem Solving.,Good Negotiation Skills."
35,404098,Palestine Polytechnic University,Computer Engineering,Unknown,"Over 16 years of experience in System Administration.,Over 16 years of experience in Network Administration.,Over 16 years of experience in Technical Support.,Over 16 years of experience in PC & Laptops Hardware Maintenance and Software Solutions.,Over 10 years of experience in Public Relations.,Over 10 years of experience in Information Management & Data Processing.,Over 10 years of experience in Strategic Planning, Capacity building & Institutional Development.,Over 10 years of experience in Proposals & Reports writing.,Excellent Communication skills.,Excellent Presentation Skills.,Enthusiastic & team player.,Strong analytic, numeric and forecasting skills.,Good ability to work under pressure, within teams and to deadlines.,Expert: System Administration, Network Administration, Technical Support, Windows (10, 8.1, 8, 7, Vista, XP, 20016, 2012, 2008, 2003 Server), MS Office 2019, SPSS.,Intermediate: DB Administration (SQL Server). Programming (C++, VB.Net), Video Editing, Adobe Photoshop. Articulate Storyine 360, iSpring.,Basic: Java, Assembly."
36,690923,Philadelphia University,Communication Engineering,Unknown,".Computer literacy (MS office, internet),,Office management,Interpersonal skills,Organizational ability,Computer skills (Typing: English-Arabic),Leadership skills,Office management,Networking,Cooperation,Creativity,Cultural awareness,Flexibility,Working under pressure,Initiative,Motivation,The ability to work as part of a team"
37,406904,Al-Balqaa Applied University,Telecom Engineering,"ARABIC,ENGLISH","POWER BI,MS PROJECT,MS OFFICE,VISIO,AUTOCAD,FIBERHOME UNM200,NOKIA AMS,NOKIA BTS MANAGER,HUAWEI U2000,ZTE SDR TOOL,SECURE CRT,INSSIDER TOOL,THERMO GRAPH,OTDR,SITE MASTER"
38,823486,"JNTUK,State Board of Technical,Board of Secondary",B.Tech (MECHANICAL),"English,Telugu,Hindi,English, Telugu","Knowledge of managing productively, Individual targets, and employee relation.,Regularity in working with in specific time and ability to seek advice.,Expert in managing people in different situation.,Having self-confidence & enthusiasm.,Interpersonal skills,AutoCAD,MS office.,Basic knowledge of computer operation, [DCA],Adaptability Attention to detail Curiosity Open mindedness Self Motivation"
39,755819,"Yarmouk University,",Telecommunications Engineer,"Arabic: Native tongue,English: Fluency in speaking, writing, and reading","Troubleshooting issues for different customer needs and requirements,Working in a timely manner,Handling high workload,Customer management,Technical knowledge with different platforms and technologies and protocols"
40,413972,Philadelphia University,Software Engineering,"Arabic: Native,English: Good","Practiced troubleshooter with excellent diagnostics and repair abilities, strong attention to detail and methodical approach.,Printers and PC expert Boost performance by thoroughly evaluat- ing and correcting different hardware and software Issues.,Ability to learn new concepts quickly and efficiently.,Hard and smart worker.,Time management.,Application support,Desktop support,Technical issues analysis,Customer service expert,Component installation,Network support,Team collaboration"
41,758201,Princess Sumayya University for Technology,Telecommunication Engineering,"Arabic Mother Tongue Language,English Excellent","Teamwork.,Creativity.,Self-learning.,Problem solving."
42,404810,"Yarmouk University,Al Hussein Secondary School",Telecommunication Engineering,Arabic and English,"Programming in C++,CCNP certified"
43,639291,O Al-Balqaa Applied University,Computers systems & Network Engineering.,"Arabic,English","Building and management network, AutoCAD, Multisim. packet tracer, Opnet, PRTG, Matlab, Altera and Intel Microprocessor. Microsoft office, Visual Basic, c++ and Python programming languages, Familiar with Windows, Linux,windows server."
44,755583,Unknown,SCIENCE IN TELECOMMUNICATION ENGINEERING,Unknown,"Linux Administration. User Management, Groups Management, Permissions Management, Ownership Management in Linux. Packet Capturing and Analysis(Wireshark, TCPDUMP) Routing Switching OSPF, BGP, MPLS, MPLS-TP Protocols Firewalls Load Balancing L2 Switches, L3 switches TCP/UDP IP Networking Ports, Protocols (http, https, Network Status Codes) MYSQL Databases OSI Model and Devices used on the layers (Physical, Network, Application layer etc.),Transmission Equipment Work Experience SDH Systems, ISM, ADM16, SLM2000 ADM Universal Huawei SDH/DWDM Systems ? BWS1600G (DWDM), Optix2500, Optix Metro1050, Optix155/622(Metro1050) Optix155/622(Metro2050) OSN1500, OSN2500, OSN3500 Siemens SDH SMA1K, SMA1/4, SMA1/4C, SMA16, hIT7030, hit7060, hiT7070 TV Decoder ? Barco Video Decoder RE 3400 (34MBits) Codes (TV) ? Barco Encoder Codes TV RE3400 (34MBits) ? Audio Codes RE 8930 Synchronization System ? SDU OSA 5533c (Oscilloquartz),Troubleshooting and link up of optical interfaces (E1, STM-1E, STM10, STM-4, STM-16 & STM-64 with customer DDF and ODFs.,Best commands of measuring equipments Optical Power Meter, OTDR, Laser Source and Ohm Meter for power connections.,Preparation of the weekly/monthly Report for the quality of Service. In addition, consolidating a performance report keeping in view an individual basis and Group wise.,Basic knowledge of the power plants employed in the telecommunications networks (Generators, Rectifier & Battery).,Attending PAT (Preliminary acceptance tests) Activity with vendors.,Preparation of detailed technical report during any outage of failure.,Provide technical support in line with 24x7 call-out routine and SLA commitments Including attendance at site in planned, unplanned & emergency situations.,Following up and tracking projects tasks during the execution stages in coordination with managers.,Dealing with the client to resolve their issue on priority basis.,Export the closing the open Rings STM16, STM64.,Performed the Joint activity (JV) with customers"
45,551887,AL MANHAL INTERNATIONAL SCHOOL,Unknown,"ENGLISH,ARABIC","Network repairs and maintenance,Switches and routers,Server maintenance,Hardware and software Support,FortiGate and Sophos, experience in network security (Firewall, VPN, Anti-Virus, Anti-Spam, Intrusion Prevention, Content Filtering, End Point Security, Web Application Firewalls, or Email security),Extensive knowledge of Microsoft based operating systems, including Windows Server 2008,2012, 2016, 2019 and Windows 7,8.1, 10,. Aruba Access point Wireless Network,Performed help-desk support for users,Installed computer lab network from scratch.,Connected computers as workgroup.,Performed computers maintenance,Install VMware Hyper visor on Server,Configure and troubleshoot DNS, DHCP, File and Print Servers.,Scanners, Printers, Network Printers.,Support onsite technical support services like hardware repair & upgrades, new computer setup,Wireless/Wired network setup and Recovery of deleted data.,Email setup and configuration using Outlook, fix mail Problems of Sending/Receiving.,Archived photographs on computers and servers.,Photographed high-quality images for both print and internet distribution.,Planned and prepared for all on-location and studio shoots.,Fabricated camera mounts and cases to capture images and protect equipment.,Installed, configured, and supported local area network (LAN), wide area network (WAN) and Internet system.,Diagnosed and resolved hardware, software and network problems and replaced defective components.,Graphic Design Consultant"
46,479516,"Princess Sumaya University for Technology,Princess Sumaya University for Technology","Information Systems Security & Digital Criminology,Management Information Systems",Unknown,Unknown
47,405793,AlZaytoonah University of Jordan,Electrical Engineering,"ARABIC (MOTHER TONGUE).,ENGLISH: VERY GOOD (READING, WRITING AND Speaking).","Arduino,AutoCAD,MATLAB,JAVA,C++,CST Studio,network design and configuration (cisco packet tracer),html,CSS,JavaScript,. python,Computer Skills: MS Windows Operating System.,Proficient human relation skills.,Able to achieve the required goals.,ability to work well under pressure.,Good verbal and written communication skills.,Relevant technical knowledge.,Problem-solving skills.,Efficiency and organized.,Team working skills.,High follow up skills."
