,CANDIDATE_REF_NUM,UNIVERSITY,EDUCATION,LANGUAGES,SKILLS
160,581218,Al-Balqa Applied University | Faculty of Engineering Technology,NETWORK ENGINEERING,"Arabic Native,English Good","Configure Switches,Windows Server,Microsoft Hyper-V,Sophos XG Firewall,Wireless Access Point,Fibaro Smart Home,IP-Camera,IP-Telephone (Avaya-Mitel),Microsoft Office,Google Cloud Work Space"
161,802063,Al-Balqa Applied University,Telecommunication Engineer,"Arabic Native,English: Intermediate","Critical thinking,Decision making,Mathematical skills,AutoCAD software,Workshop drawing,labVIEW software,Microsoft office software"
162,804991,AL-Balqa Applied University,Telecommunication Engineer,"Arabic Native,English: very Good","Microsoft office: Word, Excel powerpoint,Nemo outdoor, Handy software Phu software,Keeping abreast of work developments. Teamwork Work under pressure"
163,816765,Unknown,Electronics Engineering,"English,Urdu","Communication skills,Network troubleshoots,LAN Technologies,Routing & Switching,WAN Technologies,Network design,Window Servers,Firewalls,Routing Protocols including OSPF, ISIS, BGP and MP-BGP.,Service Layer Protocols including BFD, VRRP, DNS, NTP and DHCP etc.,Working knowledge of MPLS, MPLS-TE, EVPN, VXLAN, SDN, SDWAN etc.,Installation, configuration and maintenance of Routers, Switches & Firewalls. (Cisco, Juniper, Huawei & Mikrotik etc.) Network monitoring, analysis tuning and Initialing response and troubleshooting of network NMS alerts Designing and Deployment of Site-to-Site VPNs i.e. GRE, IPsec and DMVPN etc. Technical documentation and Database management of corporate links. Coordination with technical Teams of client Organizations. Handling user technical complaints & problems and providing ultimate solutions Troubleshooting internet related issues and deal with customer directly. Dealing with technical queries and new connection requests and analyze complaints data by making technical reports. Timely resolve customer WIMAX, 3G/4G devices issues and ensure customer satisfaction. Hands on experience on Optical Fiber access technologies i.e. GPON & Metro Fiber Optical Fiber Transmission Troubleshooting using OTDR, Optical Power meter."
164,595544,"Al-Ahliyya Amman University AAU,Al-Jazeera Schools",Networking And Security Information,Unknown,Troubleshooting Presentation Windows Server Public Speaking Virtual Machines Operating System Team Work
165,807285,"AL-Balqaa Applied University,Yarmouk university",communication & software engineering,"Arabic: Mother tongue,English excellent (Speaking & Writing)","An Excellent communication experience in formal and informal mails with different nationalities customers.,A good experience to handle the work under pressure .,Presentation skills course,Good knowledge of MULTISIM.,good knowledge of MATLAB (image processing & simulink ).,Excellent knowledge of Windows & MS Offices.,good knowledge of AutoCAD 2D/3D.,Very good knowledge of Adobe Photoshop.,-very good knowledge in Illustrator,Strong communication skills.,Hard worker under pressure.,Highly practical.,Very fast leaner.,Team work spirit and co-operation."
166,817006,"Institut des Technologies et Sp?cialit?s Cocody,Institut des Technologies et Sp?cialit?s Cocody(ITES),,Coll?ge Catholique Saint Viateur dAbidjan",Network Engineering,"French Native Language,English : Intermediate","Commissioning and configuration of OLTs,Integration with others platforms,Technical Assistance and Troubleshooting,Customer trainings,Technical support for pilot sites tests,Students trainings,Supervision and evaluation,Mentoring of two trainees (for Six Months),Engineering Diploma validation preparation,Responsible for billing and payments.,Staff Management,Recruitment,Salary Payment,Trainee as Network field Technician,Responsible for billing and payments.,Staff Management,Recruitment,Salary Payment,Good knowledge of ITs Networks,Design,Entreprise Solutions,Troubles shooting,Good knowledge of Huaweis Network Environment,Devices skills,O.L.T.,Switches,Laying of fibers,Good knowledge of WIFI RUCKUS/UCOPIA solutions,Ruckus SmartZone SE Partner Assessment Certified,UCOPIA Pre-Sales Consolidation Certification,Basics skills on software and Web Development (Php ;Windev, ...)"
167,463199,Jordan university of science and technology,Network Engineering And Security.,"English,Arabic","Very Good communication - written and oral skills,Excellent conceptual and analytical skills,Effective interpersonal skills,Ability to work multiple tasks& meet deadlines.,Capable of creating technical engineering reports through effective data collection and analysis.,Capable handling with Linux .,Solving Technic problems.,Handling phone calls & e-mails.,Punctuality,Creativity,Ability to work under pressure.,Effective interpersonal skills"
168,818928,"Al-Ahliyya Amman University,Al-Salt High School, Jordan",electrical engineering,"Arabic - Native speaker,English - Very good","High skills in electrical control systems installation and repair.,Excellent grasp of electrical maintenance work practices and processes.,Excellent computer skills (Hardware and software),Strong knowledge of electrical distribution systems and medium voltage motors.,Team player.,Ability to quickly grasp new concepts,Strong knowledge of electrical maintenance work experience,AutoCAD.,MATLAB.,Dualux.,Ecodial.,. Microsoft office."
169,573209,AlBalqa Applied University/faculty of engineering technology,Computer Engineering,"Fluent English speaker,Native Arabic speaker","Networking,Public speaking,Social perceptiveness,Security,Multitasking,Task prioritization,Time management,Written communication,Technical guidance"
170,716323,Applied Science University,electrical engineering / communication & computer,"English,Arabic","Communication,Self-motivation,Decision Making,Very good using Microsoft office, Proteus 8 & MATLAB,Ability to work as a team member"
171,414378,"Philadelphia University,Jordan Telecommunication College",Communication and Electronic Engineering,"Arabic,English","Analysts skill,Work coordination,Leadership,Teamwork,Communication"
